review_body,review_rating
candi utama daerah indah layak ramai kuil kenal kagum detail,pos
indah dekorasi indah nangka unik suka,pos
tiket borobudur prambanan murah tiket candi coba kopi gratis pintu masuk kuil indah layan dandan,pos
kuil tenang takjub indah bus harga murah,pos
sewu temple meter prambanan wisatawan indah pribadi jalan,pos
indonisia ajaib sejarah takjub layak rekomendasi,pos
kuil indah cerah panas dingin kuil bersih,pos
letak taman indah tawar peluang foto fantastis kuil buddha,pos
pandu wisata habis indah kompleks kuil lekang fabel hindu pandu hibur apresiasi suci turis,pos
mewah bangun arsitektur indah benarbenar surga fotografer,pos
candi budha kelompok indonesia candi kondisi tahan likuliku,pos
kuil daerah layak nikmat pesona gempa bumi,pos
candi sewu chandi khusus agama buddha hindu raja perintah candi prambanan candi prambanan letak candi prambanan ukir relief tenang,pos
kecewa candi prambanan candi suka hotel fitur indah sibuk candi utama benarbenar jalan,pos
kuil sewa sepeda sepeda kompleks henti candi sewu indah tenang foto,pos
kuil indah relief indah kuil kuno transportasi bus arah sinar matahari sore foto museum,pos
favorit candi prambanan letak kompleks candi prambanan jalan meter candi prambanan tenang damai nikmat kuil gambar bagus,pos
kuil komplek candi prambanan layak cepat kunjung kompleks mudah capai kereta api candi prambanan comlex jalanjalan taman indah candi sewu,pos
napas beda gambar saksi,pos
sewa sepeda siklus jarak pendek kuil kuil utama kesan tenang tenangbanyak foto bagus duduk foto,pos
monumental kesan sejarah kuil century gempa bumi candi dewa siwa brahma wisnu,pos
candi utama prambanan ramai candi sewu tenang asli batu patung rapi timbul resiko assemleb wakil kuil utama,pos
bagus candi indah,pos
perlahanlahan pudar potong takjub arsitektur ajaib layak,pos
renovasi indah jalan kondisi panas keringat utama taman,pos
jalan kaki candi prambanan tenang indah jalan turis tenang,pos
benarbenar keren set kuil indah foto november kadangkadang tahan panas pohon,pos
kereta api mini tiket masuk banding kuil prambanan indah kuil candi prambanan,pos
kuil buddha senyawa candi hindu gaet indah awat kuil daerah,pos
candi prambanan kompleks khusus candi utama kompleks contoh hindu tampil jawa,pos
indah sewu prambanan kerumun kota letak komplek prambanan tiket masuk prambanan kuil sewu jalur sewu naung pohon,pos
inap hadir nikah teman candi sewu sejarah kota kuil benarbenar takjub daerah luas jalan capai candi kuil,pos
letak taman prambanan suka gambargambar indah matahari benam,pos
hotel letak pekarang candi prambanan lainlain beli tiket borobucur biaya mahal,pos
favorit temple area nyata runtuh jelajah habis keluarga,pos
nikmat prambanan jalan kaki utara kuil agung bayar pintu masuk kuil beli tiket candi prambanan kuil bonus,pos
letak senyawa candi prambanan layan gratis henti kendara jelajah kuil,pos
candi prambanan kenal kuil sewu layak biaya tiket masuk tembak bagus,pos
kuil jalanjalan candi utama kawasan majemuk hotel banding prambanan layak upayapelihara tiket masuk gratis,pos
cinta tenang damai pandu sejarah latar panas tenang plently air tangan,pos
runtuh layak pagi hangat,pos
candi sewu megah grand borobudur monumen candi buddha kompleks jawa candi borobudur candi sewu abad,pos
runtuh layak pagi hangat,pos
candi sewu megah grand borobudur monumen candi buddha kompleks jawa candi borobudur candi sewu abad,pos
kalibiru populer view indah kalibiru tempatposisi kalibiru,pos
cinta dark chocolate pabrik coklat monggo trip bersih icip icip coklat hihi surga cinta coklat pokok,pos
suka coklat coklat monggo variasi coklat harga gram gr grlokasi pabrik pusat kota gede outlet pusat,pos
suka coklat beneran cocok kadar rendah coklat harganga start from batang beli supermarket mahal harga sesuai kualitasehya lihat proses coklat jual,pos
sulit masuk gang luas nyaman adem masukk store ruang ruang tunggutamu desain interior jawa kuno tata ruang cozy gak etalase tata rapi varian coklat jual kesan suka coklat coklat monggo benarbenar tagih makan coklat coklat enak makan harga cenderung mahal kesana promo diskon lumayan andai harga murah segan rating,pos
enak harga lumayan mahal enak varian macem,pos
test jalan tutup pohon beringin kembar tuju,neg
main mobil hias alun alun selatan hibur keluarga tata management tarif profesional adakan loket karcis tarif karcis,neg
salah lokasi ikonik singgah dagang kaki jual jajan khas malam suasana memorable,neg
istilah nyore kalang warga santai alunalun sore minum ronde sunset ngobrol duduk rumput coba ritual seberang pohon kembar,neg
salah pusat ramai malam sewa mobil hias pohon kembar jalan lurus pohon tutup mohon kabul wajib,neg
salah pusat ramai kota yoyakarta malam pekan penuh unjung daerah wisatawan manca negara wahana khas becakmobil lampu dekorasi warnawarni cocok unjung keluarga,neg
alaun selatan kenal kota main tutup pohon beringin sewa kain tutup bmata,neg
kesiniselalu gagal mitos tutup jalan lurus pohon,neg
lihat pohon makanmakan main larilarian anak gowes aka mobil mobil harga gila tutup lewatin pohon sukses,neg
wisatawan masuk tuju wisata objek wisata kota keliling pusat wisata kuliner mitos unik jalan lurus,neg
malam hibur kereta lampu makan jalan pohon beringin tutup,neg
alun alun kidul odong odongmobil hias anini sampe putar gantung sihkalo musim libur emang mahal milih makan ronde jagung bakar ajakarena lumayan gelap,neg
wisata murah riah alun keraton murah riah pohon alun sayang libur suasana ramai tukang jual makan,neg
santaisantai budget tipis alunalun selatan uang parkir jalanjalan bebas khawtir abangabang jual pinggir jalan,neg
libur rame macet jalan makan jual pinggir jalan kalu makan tinggal belok nongkrong libur keluarga ramai sepeda hias lampulampu malam,neg
kesan ramai seru pusat kota tidur malam ramai unjung keliling alunalun sepeda unik jajan murah riah muntah eitsss muntah maksud,neg
pohon beringin musium mobil kelilingbalonmakan mobil pokok lengkap seruuuuuuu,neg
alunalun selatan kota ramai sore malam becakbecak sepedasepeda mobilmobil lampu hias warna warni plus jual makan minum khas pohon beringin,neg
alun kidul alkidtempat pusat kota ramai malam jual makan ronde wisata sepeda hias lampu bentuk mobil lengkap musik wisata kenal,neg
kenal tes jalan pohon beringin tutup malam ramai mobil lampu warna warni,neg
libur salah tuju alun senang hibur mobil hias lampu ragam bentuk jual makan jejer bnyk wisatawan,neg
alunalun selatan riuh lampu malam wisatawan alunalun selatan pagi kalah santap kuliner sarap pagi dar olah ragacoba pagi alunalun selatan ragam makan sarap,neg
nongkrong seru klo malam jualanbisa duduk santai makan jagung bakar minum hangatsambil iring amen jalan mantap abis mobil penuh lampu tanah lapang luas anak mainbanyak jual main,neg
cocok habis malam jual makan pinggir jalan sepeda lampu warna warni dar tantang jalan lurus beringin,neg
alun kidul alkid asik usia becak cinta jln beringin main anak murmer klo kuliner lontong opor nasi pecel sarap cilok ngehits bangeet,neg
alunalun selatan wisata wajib udah malem dar makan jagung bakar minum wedang ronde rame main jalan tutup pohon beringin usaha beringin nggak bis sampi,neg
kunjung malam ramai unjung cocok malam alun alun pohon mitos jalan,neg
alunalun kidul alunalun selatan dapar pohon beringin kembar mitos pohon tutup lurus kraton maksimal coba rame,neg
jalan pohon beringin tutup keraton coba gagal challenging coba,neg
alunalun selatan kenal alkid alunalun kidul beringin kembar unjung coba tengahtengah tutup kain malam ramai becak musik kencang lampu hias,neg
pagi pagi siang malam pagi gak sepi joging nongkrong syantik becak hias cilok baso tusuk setan leker jajan komplittttttttttt temu janji ma temen temen medang ronde dengar musik calung,neg
pohon beringin kembar pancing penasaran unjung coba has,neg
mitos jalan beringin alun alun selatan kota kabul jalan kanan yaheheheheheh,neg
sore malam ramai jual sewa sepeda ihas mobilmobilan hias nikmat jajan kaki main malam,neg
wisata kota ramai malam sepeda hias lengkap lagu jual makan khas,neg
alunalun udah malem malemmalem tutup jalan lurus belokbelok untung lurus jalan ngelewatin pohon,neg
alun alun kidul malam malam ramai mister pohon beringin tutup,neg
malam suasana ramai becak dengen led jual makan yan mengangggu amen,neg
alun kidul keluarga main malioboro sdh cerita alun kidul becak motor lumayan jalan beliau,neg
teman mitos pohon beringin alkid penasaran coba jalan lintas pohon beringin coba hahahaha mitos aneh asing lucu,neg
letak keraton siang sore jual minum makan pinggir jalan malam becak cinta becak lampu hindar libur macet,neg
lokasi mudah pinggir jalan suasana adem nyaman percaya jalan mundur pohon niscaya beruntungsebagai simbol percaya,neg
klo pagi olah raga sarap lontong opor klo malam aktivitas becak cinta muahaal klo lg libur phn beringin main anak,neg
lengkap alun alun suasana keluarga jual ronde jagung bakar recomended,neg
nyaman unik pohon beringin kembar konon pohon beringin kembar kaan jodoh salah lihat coba gagal,neg
tantang utama objek wisata pohon beringin tutup lenceng tabrak pohon nihil seru tantang sepele jarang,neg
ramai enak nyaman jual makan cocok rekreasi keluarga,neg
sayang debu bagus kumpul kumpul beringin sewa tutup main enggrang,neg
daerah ramai angkring anak beli main baling kerlap kerlip sepeda mobil lampu peak season libur harga sepeda mobil mahal banding,neg
tarik mobil pancal warna warni anak anak suka malam ramai trus pohon bringin alun alun coba tutup,neg
theres park locally taste nongkrong asik teman keluarga nuansa kental letak bbrp museum benteng kraton,neg
salah wisata malam malam sepedasepeda hias warnawarni lampu nyak jual jajan lokal,neg
khas lokasi challenge tutup mara pohon alunalun konon kabul sewa tutup harga slayer,neg
malam ramai jual makan main anak anak ritual laku jalan arah pohon beringin tutup,neg
main main alunalun kidul malam ramai keliling alunalun kidul sepeda hias bentuk mobil sepeda tandem seru alkid tawar sewa sepeda tandem sepeda,neg
sore malam haritempat santai enakterdapat makan pinggir jalan konsep leseh,neg
lengkapa coba mitos lintas tengahtengah beringin kembar syarat tutup konon mudah jodoh sepeda wisata bentuk,neg
ramai lokasi hilang minat ntah wisatawan habis wartu duduk santai pinggir jalan nikmat kuliner sewa odongodong harga makan jangkau,neg
jajan sihsama main mainnyanyewa mobil musik kelapkelip lampunyahahadi alun alun kidul pohon konon nglewatin pohon tutup penginin kabul,neg
kunjung ramai jual souvenir khas harga murah malam menaikki odongodong full musik jajan hangat malam,neg
salah hibur malam kota sedia sepeda hias leseh menu kuliner alun alun harga jangkau,neg
sore main alun alun kidul letak strategis sore suasana main alkid jual pinggir jalan main,neg
coba jalan beringin tutup mitos kabul,neg
alun alun alkid alun alun kidul buah pohon beringin ramal unjung unjung tutup jalan tutup,neg
santai emba ombongombong malam jalan jalan,neg
alunalun selatan ramai malam angkirangan alunalun beringin alunalun malam sepeda hias lampu warna warni sewa unjung,neg
seronok temen teman sepeda lampu cantik malam gelap hias lampu lampu sepeda cuba pohon bayan tutup sukar,neg
pohon beringin mistis unjung enakya siang bolong panas terik sore malam sip suasana ramai sepedasepedaan tandem hias lampu warnawarni,neg
malam makan malam coba untung jalan tutup celah pohon beringin,neg
siang langsung sholat ied kondisi lapang kotor penuh kertas koran bagus sore malam pasar rakyat,neg
malam sengaja malam ramai tukang dagang lampu kerlap kerlip mobil becak suara house music gelegar menyenagkan nongrong alun coba untung,neg
alunalun selatan tuju bias lintas pohon beringin mitos tutup bias jalan lurus pohon beringin capai temanteman coba kesana,neg
dar jalan nikmat malam kota alunalun kidul main pohon kembar jual alunalun makan teman nyamuk,neg
laku jalan melewti pohon beringin denganmata rutup alun alun malam harikarena mobil seoeda becak lampu lampu hias,neg
alunalun ramai malam kereta hias alun senang teman keluarga beramairamai,neg
alun alun kidul letak keraton alun alun kidul kendara pusat kota kendara pribadi rekomendasi malam malam alun,neg
alunalun senang nggak berisik lampu musik hingar bingar ruwet nggak karuan rindu suasana alunalun kidul unjung tenang lampulampu silau,neg
larut malam alunalun ramai salah giat pohon beringin kembar pinggir lapang sepeda mobil lampulampu kendara,neg
siang sepi jalan tutup arah pohon siang karna gangguin malam aktivitas laku makan leseh,neg
alun selatan aangat ramai unjung malam harikarena jual makanjajanan pinggirnyadi sewa mobil goes harga tertentudisini pohon beringin legenda daerah lewatjalan pohon,neg
alun alun selatan pohon beringin yand duduk jalan tutup jalan kabul mobil warna warni alun alun selatan pinjam,neg
panas rumput lapang kering warna hijau jalanjalan alun alun cuaca sejuk jalan tutup jalan beringin tutup,neg
alun alun selatan pohon beringin tumbuh tutup jalan pinggir jalan jalan pohon beringin fokus percaya,neg
alun alun kidul objek wisata wajib kunjung untukdatang malam banyakorang game tutup pohon alunalun sore,neg
alun alun selatan pohon beringin kuat magic situ main tutup jalan kaki tutup pohon beringin citacita wujud suasana sore enak rame,neg
alunalun selatan sepeda hias lampu seru laku temen mitos pohon beringin pohin beringin tutup merupaakn,neg
malam tampatnya luas legenda bosa jalan mama tertupu pohon keiginan cita kabul sepeda bentuk mobil nyala malam lampu,neg
salah mitos populer kembang tumbuh pohon beringin kembar mitos jalan tutup ruang beringin pikir capai,neg
objek wisata kenal sejarah mistisnyatempat letak selatan kota warga alun alun selatan santai istirahat keluargasahabatmau gebetan kenal,neg
temanteman alunalun kidul kirakira minum kopi joss stasiun tugu tuju alunalun kidul temanteman coba mobil ontel,neg
alun alun kidul tawar wisata santai sore malam suasana ramai sewa mobil lampu sepeda tendem jual makan alun unik beringin kembar konon bias,neg
pohon beringin kembar kenal konon jalan lurus masuk pohon beringin tercapaijadi gak heran malam ramai penasaran jalan tutupkamipun ituselalu,neg
alun alun selatan salah wisata malam nongkrong sepeda berhiasakan miniatur mobil lampu hias main pohon tutup pokok seru,neg
judul ulas legenda alun selatan kuat tanam masyarakat jawa ritual jalan tutup pohon beringin alun malam penuh mobil sepeda penuh hias lampu interaksi,neg
ramai wisatawan sore sepeda hias sepeda mobil adat tutup jalan pohon beringin kembar,neg
keluarga alam senang dar mobil genjot hias lampu warna warni jajan alunalun selatan kaki cape happy putara,neg
keluarga nikmat ramai alun alun kidul sepeda sewa putar alun alun unjung coba pohon beringin pohon beringin,neg
tau alun alun selatan pohon kembar dateng lengkap pohon anggap neng neng sampe keselep nyerah dateng,neg
khas ikon kraton coba lintas tutup nggak lurus parkir susah,neg
nikmat malam kopi joss enak alunalun selatan pohon beringin konon jalan lurus tutup megah mistis anak becak,neg
lampu lampu mobil dayung becak uang main lapang main seru jalan lurus pohon tutup konon impi capai,neg
siang malam alunalun ramai suka malam jual makan mobil dayung,neg
pohon beringin mitos konon tutup hajat makbul gak karna paksa,neg
alun alun selatan pohon beringin tua konon pohon beringin tutup kabul bas takluk tantang pohon gagal,neg
nyampenya malam dagang kaki jual alun alun selatan kuliner khas nasi goreng mie goreng areng masak bara arang,neg
alun selatan kenal pohon beringin kembar mitos jujugan wisatawan coba mitos malam ramai ramai becak gowes,neg
andaanda kota gudeg alunalun kidul selatanred jumpa jaja makan mainanmainan tradisional asik alunalun kidul malam sewa becak gowes bentuk ragam full music,neg
alun alun selatan wisatawan domestik malam karna ramai becak becak cantik bentuk kendara keliling alun alun pohon mitos,neg
t dak dar keraton arah alun alun selatan n kenal pohon ber ng n kembar konon s has l jalan d tutup ng nanny kabul m tos n tar k m nat w satawan h ngga mnjad dest nas waj b,neg
ramai sesak hindar mobil parkir jalan kaki,neg
salah wisata arah keraton kenal pohon beringin kembar mitos jalan lurus tutup kabul pandang,neg
nongkrong alkid malam makan jagung bakar minum wedang ronde muter alkid mobilmobilan lampu warna warni ramerame seru coba main masuk beringin konon hati bersih,neg
salah obyek wisata wajib letak keraton alunalun utara pohon beringin kembar pasangn pohon beringin tutup kain pagi jogging sarap lontong opor nasi kuning malam,neg
jalan jalan kota lengkap coba untung jalan pohon beringin tutup pohon bahas program tv cobahaha,neg
siang senang lokasi panas malam alternatif santai malam main anak nikmat,neg
malam becak lampu semarak anak anak senang krna jual main,neg
bosan unik jalan tutup percaya jalan pohon beringin kabul,neg
alunalun selatan malam unjung coba beringin tengahtengah alunalun malam gelap semarak coba sewa mobilmobilan hias odongodong,neg
rubah alunalun kenderaan lampu hias sewa keliling alunalun bentuk mobil kayuh kaki hibur tutup jalan pohon,neg
suka ramai malam angkring food stall sederhana sedia lokasi beringin mitos jalan lurus beringin tutup,neg
wisata murah riah mlm alkid pilih tradisi jalan pohon beringin mkn minum leseh plus musisi jalan sepeda hias indah lampu kerlapkerlip ramai unjung kdg sulit parkir sembari nikmat wedang ronde susu jahe alkid,neg
seru ramai sore malam warung makan mobil lampion lokasi jalan ngadisuryan delman becak alunalun kidul selatan malioboro tarif mahal jalan kaki capek,neg
mitos jalan poho hati bersih should try,neg
alun alun siang apapa temen temen main tutup pohon jodoh bayangin,neg
wisata malam asik makan simple mahal wedag ronde mie jagung bakar sambi maen jalan beringing susah maen mobil lampu seru abis,neg
alunalun selatan alkid ramai sore malam alunalun luas buah pohon beringin tengahtengah pohon beringin mitos warga konon jalan tengahtengah pohon beringin,neg
suka olahraga malam colourful night odongnya penuh kampu warnawarni full music iseng jalan tutup,neg
jalan tutup tembus pohon beringin kembar terdistract suasana alun alun kidul,neg
murah riah wisata dsn naek sepeda lampu skrng bentuk mobil makan jagung bakar wedang ronde hik harga mahal jagung bakar enak,neg
lokasi kraton wajib mitos pohon beringin kembar jalan pohon dengana tutup,neg
alunalun kumpul warga memnghabiskan luang pohon melambang lakilaki perempuan main tutup usaha jalan arah celah yan pohon aneh,neg
lengkap coba alun alun selatan tutup banding alun alun utara malam ramai coba sepeda modifikasi lampu warna,neg
alun selatan hadir pohon beringin bejalan tutup lintas jalan pohon beringin wujud percaya alun selatan masyarakat,neg
malam ramai sepi unjung jual makan main areal buka ruang publik area hibur masyarakat unik pohon beringin kembar lapanan alunalun,neg
riah malam becak bentuk mobil his lampu warna warni keliling becak sewa teng alun alun pohon beringin kembar kenal,neg
pagi malam pagi ramai olah raga jogging malam ramai leseh angkring lokasi sepeda hias lampulampu nyala sewa coba,neg
alun alun selatan letak keraton ramai unjung giat kenal alun alun coba tembus buah pohon beringin tutup nampak mudah konon,neg
alunalun kidul alunalun kraton kenal alkid lokasi keraton nikmat alkid malam pagi weekend ramai sembari coba untung tembus beringin kembar tutup kain,neg
lapang kumpul ramai daerah kraton ramai jual makan main malam suka jalan santai,neg
ubah radikal aktivitas malam bagus tradisional jalan pohonpohon sepeda penuh warna ajaib hilang,neg
datar taman rawat salah bangun indah latar istana sultan objek wisata square kecuali pohon,neg
pohon bosan kraton percaya kraton libur buruk,neg
southern city square letak jalan malioboro kraton area siang aktivitas main bulu tangkis obrol,neg
benarbenar lucu pikir mudah benarbenar mudah jalan lurus pohon siang malam inap malam jalan ramai mobil kartun,neg
lapang kosong keraton istana keluarga anakanak senang mobil sewa sepeda roda jual main bagus malam,neg
mitos kenal banyan tree twin jalan tubuh putar hati bersih senang coba,neg
duduk malam gelap kios warung jual ronde jago makan duduk coba makan tradisional lokal matt tutup coba,neg
salah ikon pohon beringin coba lulus pohon beringin bukti pikir positif karakter lokasi jalan malioboro daerah mobil lintas main,neg
malam nikmat makan pandang suara becak jalan ramai lagu pop alam,neg
kamar liar sambut jatuh malam lampu mobil riah pancal,neg
mari omeone mengagakagihkan tradisi coba jalan kaki pohon beringin mudah pemuda sayang habis malam senang gabung,neg
malam mobil pohon kenal coba untung jalan tutup bagus hotel,neg
daerah pusat kota pohon masyarakat percaya belintang pohon tutup keluarga coba benarbenar keras,neg
benarbenar mengkwadratkan tutup minum lihat jalan kaki pohon legenda,neg
malam ramai objek wisata utama pohon mitos tutup liech pohon hidup,neg
daerah pusat kota pohon masyarakat percaya belintang pohon tutup keluarga coba benarbenar keras,neg
benarbenar mengkwadratkan tutup minum lihat jalan kaki pohon legenda,neg
malam ramai objek wisata utama pohon mitos tutup liech pohon hidup,neg
sisa libur main mallbanyak produk hiburtp karna tuju mall makan makan ngga susah brangkat jalan makanjalan makan lagipulang hotel tinggal mandi istirahat,neg
berangkat pesawat tunda mal pinggir jalan utama jalan benarbenar lelah tunggu akibat tunda pesawat pesawat tunda berangkat pikir makan bandaraletak mal strategis jalan hubung jogjaslemansolo sentuh mal akibat letak kota titik turun tumpang enak pinggir jalan adisucipto parkir letak mal mal luas tenantnya lengkap foodcourt bingung makan resto fasilitas mal lengkap tenant resto food court ibadah parkir luas tukar valas bagus wisman plaza luas expo kpr hotel mal belah salah hotel top bandara mudah gapai harap perhati terbang temantemanambarukkmo plaza tunda jadwal terbang terima kasih reda rekomendasi tulis dedikasi kawankawan mrs rdo jumpa jelongjelong,neg
ngadem jalan jalan macettapi gak rugi mall jalan cuci mataterus makan foodcourt,neg
mall dar jalanjalan belanja enak mall sedia dudukduduk enak ramai malam nikmat ronde,neg
ngemall salah giat gerah macet hujan plaza lengkap tenantnya nongkrong kopi makan cuci belanja department store akses transportasi taxi bus online cab,neg
mall enak jalan lengkap belanja rmh tangga carrefour makan resto foodcourt fashion tenant bagus pokok mall favorit,neg
mall nyaman cocok kalang masyarakat sedia outlet branded transmart lengkap,neg
mall ramai tenant bosan muter lantai cocok food courtnya,neg
makan pakai merk bagus mall letak jalanparkir motorbisa pinggir jalan,neg
mall fasilitas lengkap akses mudah lokasi kota,neg
mall salah mall kunjung malioboro mall terseda masjid mall tenant makan,neg
mall ambarukmo mall ngetop lokasi strategis jalan solo taman asri mall tenant mall lengkap fashion kuliner toko buku teater,neg
salah mall mall letak jl adisucipto pusat belanja posisi ideal lancong long weekend jumat sabtu minggu ramai istimewa mall masjid,neg
jalan jalan mall ambarukmo mall bersih lengkap foodcourt luas menu toilet wangi,neg
gapernah strategis nyaman jual mall baju sepatu tas makan pernakpernik aksesoris harga banderol ragam jangkau mahal,neg
keliling amplaz nyaman fasilitas sedia lengkap harga berfariasi sedia wifi gratis akses log social media wii kecewa,neg
salah mall nama ramai free parkir cock kuliner santai suasana,neg
retail ambarrukmo plaza isi rugi mall dinding hording harga mahal,neg
mall pusat kota halte busway depanac dingin free wifi toilet bersihdi foodcourt view supermarket besarjuga fastfood outlet,neg
mall ambarukmo salah satut mall representative kota tenant local internasional mall design mall menu makan area food courtnya bias xxi,neg
jalanjalan libur keluarga mall initapi keringat dingin taksi ipad tas tas tinggal toilet sontak panik cemas optimis,neg
mall daerah parkir mobil pekan libur parkir jalan solo macet mall bilang mall,neg
mey kesana janji teman motor helm titip titip helm basement plaza ambarukmo kecewa teman,neg
mal bersih acnyq dingin papan lengkap bangun gak bingung geraigerainya mahal kantongkubiasanya nonton bioskop kuliner belanja carefour makan fav hayam wuruk ayam goreng telur asin enak lantai ama counter,neg
ambarukmo plaza amplaz salah mall lokasi strategis jalan solo amplaz mall mahal tenant isi mall brand premium mall cocok keluarga,neg
one stop shopping mall can find carrefour supermarket gramedia book store fashion store food coffe shop many more minus nongkrong kfc wifinya mall connect lot,neg
salah mall mewah masuk mewah megah lengkap,neg
mall film xxi bingung parkir motor motor parkir parkir kelola mall amplaz bingung parkir motor mall ramai unjung,neg
favorite mall salah mall toko lengkap toko baju supermarket carefour toko sepatu hias makan lengkap parkir nyaman luas ramai weekend tanggal merah,neg
wisata kota salah belanja wajib fasilitas lengkap makan mall,neg
salah one stop shopping makan belanja tukar valuta asing tenant istimewa,neg
muncul mallmall nyaman amplaz saing tenanttenant amplaz semarak hadir charles keith wakai timberland suka musholla amplaz musholla bagus ukur mall letak,neg
ambarukmo plaza amplas salah pusat belanja amplas letak jalan laksda adisucipto kompleks hotel royal ambarukmo amplas outlet lengkap foodcourt luas sedia bioskop mushola,neg
mall lengkap brand kenal cocok jalanjalan teman keluarga pacar sedia restaurant cema movie akses mudah capai susah parkir weekend libur,neg
ambarukmo mal letak jalan solodan ambarukmo hotelhotel klasik kenal yogjakartamal ambarukmo ramai weekend mal ambarukmo kuliner kuliner enakbusway henti mal ambarukmojadi khawatir,neg
nyaman nongkrong starbuksnyamakan store pakai lengkap akses jalan kesana mudah,neg
pusat kota wajar mall ambarukmo utama lengkap tenant store kenal lengkap,neg
