review_body,review_rating
wisata alun alun kidul selatan keratin malam senang tawar becak wisata keliling alun alun selatan harga cukuo murah rukiah putar alun alun wisata tutup tantang lintas pohin,pos
alun alun selatan jm malam ramai mobil odongodong cahaya lampu sewa mengowes putar alun alun selatan harga variasi alun alun selatan,pos
mantap gak alunalun kidul selatan jogjaini pohon beringin pohon capai jodoh gituihihihi,pos
nikmat indah sore malam alunalun kidul senang suasana segar hibur makan foto bias becak cinta keliling alunalun nikmat makan minum khas wedang,pos
seru keliling alunalun mobil lampu biaya jangkau putar mobil sedia lagu suara kenceng,pos
alun alun lapang kota kota mitos pohon beringin alun alun cita cita kabul,pos
yaaa akalu gak alun alun kidul kek ritual ksni gak yaaa mobil nyala far enak sayang ksana malam gak pohon kembar,pos
dar nongkrong kumpul teman malam nikmat indah cahaya lampu mobil suasanan santai,pos
seru malam odong mobil sepeda hias penuh lampu jajan ramai nawar sepeda harga lumayan mahal tawar,pos
liat pohon beringin legendaris makan alun alun,pos
cocok habis malam mutermuter alunalun kidul sepeda tandem odongodong lampu riah keren dengar musik beatnya lumayan cepat ajepajep hahaa jalan alunalun tutup,pos
coba odongodong lampu hias sayang musim libur suasana ramai macet sewa odongodongnya mahal putar tawar,pos
halaman diam raja sarat folklore akrab alunalun kidul keraton nampak laut selatan jaga ratu kidul konon hubung magis,pos
beringin kembar pasang tutup langgeng legenda unik nang rindang pohon,pos
wisata unik keliling becak wisata warna warni pkl makan khas,pos
akun alun selatan alun alun kidul mistis pohon beringin konon pohon beringin simbol gambar raja ratu,pos
suasana hidup merkayat santai gambar alun alun kidul keraton laku lepas senja makan malam leseh dar seruput wedang ronde coba pohon beringin kembar tutup odong,pos
alunalun keraton luas kumpul warga kadangkadang aktivitas seni budaya lainlain unik pohon beringin kembar,pos
sejarah khas bangun keraton mobil hias lampu sepeda biaya lumayan murah keliling alkid alun kidul romantis pasang sedia angkring wedang ronde,pos
senang wisata malam cocok indah malam malam jalan sedia angkut indah keliling,pos
suasana alun alun selatan relatif tenang damai banding malioboro cocok cinta wisata spiritual lokasi jalur malioboro keraton,pos
alun alun kidul tau lahir kreasi sepeda lampu bentuk unik tanding indah kreatifitas sepeda lampu alunalun kidul sepeda lampu beringin kembar percaya kabul,pos
malem mobil kayuh super duper heboh full musik penuh gemintang pandang unik lucu gak main tutup,pos
alunalun letak aktivitas warga hilir mudik alunalun luas indah pinggir alulan pohonpohon rindang angin sepoisepoi aktivitas pusing,pos
alun alun kuliah lokasi leseh tenang anak anak muda nongkrong nikmat alun lagu khas amen jalan perhatianharga murah lokasi nyaman letak,pos
cocok salah istirahat cocok lg sore jelang petang komunitas kumpul unik spti nnti pohon beringin lapang,pos
duduk santai nikmat wedang ronde asi malam fi alun alun saksi main kendara lampu kelap kelip indah sewa unjung alun alun,pos
spesial becak lampu trus gerbang pohon tutup jodoh cepat hahahaha gak bisabisa,pos
selatan keraton alunalun selatan warga main bola senda gurau nikmat senja seruput kopi teh manis teman angkring makan singkong pisang goreng gethuk alunalun selatan pohon,pos
beringin unik percaya tutup beringin hati bersih wisata kuliner tar alon unik becak warna warni sewa,pos
alunalun selatan khas pohon beringin anak muda coba untung coba pohon beringin tersebuh tutup kabul minat,pos
rameeeeee suasana angkring dapet makan wedang ronde nikmat malem,pos
pohon beringin untung betah malam penuh lampulampu indah sepeda sewa,pos
lumayan kendara becak keliling masuk keraton sore enak,pos
alun alun selatan ruang publik senang nikmat unik sepeda lampu coba legenda nikmat jajajan lokal duduk menikmato sore ramah anakanak lansia,pos
tradisi percaya alun selatan pohon beringin tutup capai inti tradisi fokus tenang tutup sewa,pos
malam sepi wisatawan mudamudi besarkecil manfaat enak kaum tinggal selang makan limpah ruah,pos
alun alun selatan areal buka luas sasono hinggil keraton pagi joging senam warga jual makan angkring bubur ayam susu murni aktivitas pagi,pos
cocok malam sedia becak odong odong hias lampulampu cantik coba untung jalan tutup pohon,pos
malam mengunjunggi alun alun selatan sewa andong transportasi tradisional jalan hujan lumayan deras cafe tunggu hujan reda reda sewa sepeda becak pasang,pos
sabtu matahari tenggelam suasana indah ramai sepeda cantik modifikasi mobil hias lampu warna warni biaya sewa putar alunalun,pos
pohon simbolis ciri khas pandang pohon beringin taman buka,pos
santai malam warung makan musik terang benderang sepeda sewa pohon beringin mitos hati murni jalan tutup,pos
pandang giat matahari benam lentera modifikasi sepeda bagus musik makan minum tradisional nikmat padang rumput unik pohon sawah percaya,pos
yogyakrta turis turis lokal alun alun selatan nikmat malam interaksi duduk senang makan makan kaki lezat penuh malam,pos
malam duduk lokal benarbenar terang sepeda unik mobil duduk percaya jalan pohon pusat tutup untung,pos
siang malam lampu mobil sewa sepeda tamasyawan jl bagus jenis keaktivitetan negara indah anakanak suka,pos
taksi alunalun selatan alunalun kidul mengkwadratkan selatan mudah haruskunjungi situs hotel unik populer unjung kota,pos
taman king palace malam cahaya sepeda kerumun santai kumpul keluarga pusat,pos
utama pohon banyan town square keraton old palace kota tinggal malam malam,pos
taksi alunalun selatan alunalun kidul mengkwadratkan selatan mudah haruskunjungi situs hotel unik populer unjung kota,pos
taman king palace malam cahaya sepeda kerumun santai kumpul keluarga pusat,pos
utama pohon banyan town square keraton old palace kota tinggal malam malam,pos
ambarrukmo plaza lega ragam tenand penuh area mall mall mudah akses area malioboro uang ojek online,pos
mall sedia makan komplit bioskop cocok habis weekend ngadem,pos
belanja mall ambarrukmo plaza luas megah suasana nyaman bersih ramai parkir luas,pos
amplaz ambarukmo plaza salah mall luas keciltapi mall mall asyik jalan,pos
lokasi pusat kota libur weekend macet mall cocok hangout temanteman resto shopping brand lantai khusus gadget money changer,pos
ubah pusat belanja nonton film makan malam resto marugame udon crepe signature parkir luas ruang tunggu sedia supir tarif parkir motor,pos
arsitektur sederhana elegan tata rapi unjung nggak bingung,pos
bangun lantai megah elegans populer amplas akronim ambarrukmo plasaplaza super mall kota gudheg tuju belanja kuliner barangbarang merkqualifiedbanyak gerai tawar produk harga relatif mahal belanja,pos
asyik nongkrong kawula muda nontonnya makan outlet baju harga wajar adeeeem deket jalan raya mudah jangkau kendara deket bandara jugaaa keren pokok,pos
belanja barangbarang branded mall hibur nyaman lokasi strategis letak hi hotel ambarrukmo mall gengsi koridor lapang semarak dekorasi natal,pos
desember suasana natal bolabola emas gantung juntai mall indah sedia lengkap fashion elektronik gadget resto mall,pos
mall ambaraukmo plaza kenal amplas mall mall letraknya samping hotel ambaruko plaza lengkap modern shopping,pos
amplaz letak hotel royal sedia cafe resto butik harga mahal mall mall modern cocok hangout remaja,pos
aroma khas melati rest room senang cleaner ramah wifi guest tida mengcover area user slow down tingkat kbps user aroma sedap,pos
acara mobil kendali jarak koridor utama kendara trans berangkat shelter jalan jelajah plaza makan malam stamina,pos
lokasi mall bagus tenant lengkap brand brand tawar common seragam mall mall daerah jawa diysemoga brand brand surabaya jakarta masuk mall,pos
pusat belanja ngetrend nongkrong anak muda ragam restoran fastfood gerai makan label internasional departemen strore cntro grosir crrefour entertainment lantai operasi bioskop,pos
mall letak damping hotel nama sepi unjung weekend gaji mall penuh sesak ratarata jual brandbrand kenal keluarga nikmat saatsaat belanja mall,pos
hidup kota jakarta rindu suasana mall mall mall brand fashian nama model fashionnya beda,pos
mal surga makan starbucks jco bread talk pujasera taman sari sedia ragam makan khas indonesia internasional sedia bioskop xxi teater nyaman senang cuci minus parkir waspada,pos
bagus mall toko layak mal mewah louis vouitton prada gucci food court lantai variasi makan cina jepang barat korea makan cuci mulut dim sum,pos
mal toko tokotoko kafe produk susu kota suasana modern,pos
pusat belanja toko elektronik makan cepat restorantoko serba bioskop bagus tukar uang sedia carrefour megamart tata rambut kios,pos
bagus kota tawar toko merek outlet benarbenar merek mewah kelas layan,pos
loated jalan utama bandara hotel bintang outlet mall toko merek eatries pelihara penuh sulit parkir,pos
pikir mall jalan galleria mall malioboro mall merek starbucks supermarket carrefour merica makan siang ikan co benarbenar suka korea patbingsu,pos
bagus jalan hujan super hotel merek carrefour beli lengkap murah duduk ruang mal,pos
jakarta surabaya munich london mal belanja buang belanja barangbarang kota fantastis butuh makbul uang,pos
makan restoran variasi oreintal pekan penuh sesak senang,pos
juni pusat belanja populer generasi muda restoran carrefour habis hujan cariberbelanja nikmat cangkir kopi,pos
gigit lihat letak jalan utama capai taksi jalanjalan duduk nikmat cangkir kopi starbucks pintu masuk mall,pos
plaza mudah angkut plaza plaza empoh plaza laku,pos
hotel utama new ambarukmo palace hotel salah modern pusat belanja indonesia,pos
hotel utama new ambarukmo palace hotel salah modern pusat belanja indonesia,pos
bakpia pathok kenal bakpia enak tekstur lembut cemilan wajib pulang oleholeh bilankita jogjasy beli kacang hijau keju kacang hijau kadaluarsanya cepat keju keju tahan minggu taruh kulkas bakpia taruh kulkas hangat tekstur bakpia lembut lunak keras bakpia beda kualitas bakpia merek,pos
salah bakpia kenal enak variasi harga lumayan,pos
parkir luas bis capai becak andong tunggu belanja bakpia macha empuk lembut worth,pos
bakpia pathok oleholeh beli pabrik bakpia pathok bakpia pathok lembut tekstur hangat macammacam harga kotak kesana uang beli,pos
bakpia salah bakpia enak juara enak lembut sedia fresh toko,pos
malam ramai bakpia hangat wangi sedia testerfave bakpia premium keju durianselain jual bakpia sedia kuekue kripik khas solo oleholeh layan packing belanja sedia kardustali rafia layan belanja dipacking hotelo iya karyawannya kasir jual packing parkir layan sopan ramah gak terima tips,pos
marketing bakpia pathok jalan malioboro becak tawar bakpia pathok bis sewa tawar jual luas bersih bakpia pathok hangat harga variasi standard kacang hijau harga kotak harga premiumhampir teman beli bakpia oleholeh khas,pos
bakpia snack khas jawa harga standar bakpia juara kacang hijau coklat keju green tea tukang becak,pos
enak beli bakpia premiumk biji biji coklat keju beli bakpia hangat kasir rombong bus jujur potong harga potong parkir,pos
bakpia pathok hati lezat bakpia keju coklat kacang hijau durian kue spesial bakpia,pos
nyam sukaa sm bakpia juara atw lg ksna titip beli top,pos
variasi kisar harga normal free parking liat proses bakpia live layan staff muas sedia jenis variasi bakpia,pos
lokasi jalan malioboro becak mobil bakpia pathok kue khas cocok oleholeh keluarga rekan bisnis enak kacang hijau,pos
bakpia pathuk distribusi outlet lengkap parkir luas suka bakpia produk keju kacang merah kacang ijo durian produk premium lembut,pos
langgan keluarga simbah keluarga pabrik simbah bakpia lawas tahan buka,pos
bakpia enaak lembut gigit beli bakpia pathok,pos
bakpia enak panas empuk original enak rang kotak lumayan enak fresh oven,pos
sambut ramah semangat tawar bakpia klau harga murah bakpia enak worth karna beli bakpia bonus pcs bakpia coklat lumer,pos
kenal bakpia andal bakpia enak renyak tahan bahan awet bersih dtg pabrok jlkarel sasuit tubun masuk gang,pos
bakpia pathok bakpia pathok enak luput beli suka keju bakpia awet tahan awet pabrik,pos
lumayan buah tangan pulang nyari bakpia bakpia saji hangat hangat oven recomended nyari oleholeh swdiakan uang bakpia harga banding bakpia,pos
bakpia kenal merk bakpia referensi utama lokasi dian,pos
merk bakpia muncul bakpia pathok juara suka bakpia kumbu kacang hijau gurih manis legit desa pathok pabrik bakpia produk bakpia bandara,pos
tawar suka original kulit tipis manis kacang ijo empuk suka nyaman ramai ujung beli oleholeh layan cepat gesit ramah,pos
toko oleholeh bakpia pathuk dar belanja makan oleholeh pabrik makan oleholeh rahasia proses unjung bebas potret proses masuk pabrik toko,pos
proses cicip bakpia hangat proses singgah bakpia oleholeh makan khas,pos
jenis bakpia edar istimewa istimewa beli pabrik pinggir jalan utama jorok sedia jenis makan bakpia,pos
bakpia pathok variasi kacang hijau keju nanas cokelat campur bakpia benarbenar fresh from oven hangat beli oleholeh awet bakpia enak lembut pagi,pos
bakpia original rasax enk bgtkacang hijau lembut kulit bakpia lembutharga ama rasax,pos
pabrik proses produksi bakpia beli hangat oven layan ramah bantu kemas kardus khusus oleholeh rancang bagus mudah tenteng aman jalan,pos
coba bakpia pathok variasi bakpiabakpia beli tokotoko bakpia bakpia tawar bakpia suka bakpia original kacang hijau,pos
malioboro supir becak tawar imingiming tarif becak rupiah beli bakpia charge lipat,pos
bakpia pathuk bakpia kenal wisatawan bakpia jual panas kacang ijo keju coklat durian makan khas wingko pia cocok,pos
suka makan jual hangat makan jual fresh beli variasi makan jual limpah makan khas bakpia makan khas,pos
bakpia pathok keju enak aneh harga mahal enak jaga kualitas citra bakpia pathok,pos
fasilitas hotel inap belian minim box lumayan segar,pos
kesana sambut karyawan lihat barang biar nanya kualitas bakpia cenderung keras halus,pos
suka cita premium keju cokelat kirim kota rambak kerupuk kulit sapi,pos
surga suka ngemil ragam makan ringan gigit gigit manis asin gurih pedas bakpia pribadi geplak,pos
cocok pesent temanteman populer merek harga avordable,pos
beli bhakpia kue tradisional toko strategi mudah capai becak paddicab bhakpia pathok beli hadiah teman kerabat,pos
toko bakpia daerah jalan pathuk bakpia pathuk dapur bakpia situs cicip bakpia hangat segar beli,pos
sopir rekomendasi coba bakpia benarbenar coba contoh bakpia lezat proses bakpia staf super ramah sejarah outlet proses,pos
sopir rekomendasi tawar bakpia beda beli coba laku pribadi suka nanas harum manis,pos
selera segar oven bakpia interior layan area parkir luas,pos
suka asli kacang hijau plombir bakpia lembut bakpia tekstur komposisi plombir cicip suka buka saksi proses produksi bakpia,pos
beli kotak tur bakpias produk lezat jual makan bakpia alim bagus,pos
beli bhakpia kue tradisional toko strategi mudah capai becak paddicab bhakpia pathok beli hadiah teman kerabat,pos
toko bakpia daerah jalan pathuk bakpia pathuk dapur bakpia situs cicip bakpia hangat segar beli,pos
sopir rekomendasi coba bakpia benarbenar coba contoh bakpia lezat proses bakpia staf super ramah sejarah outlet proses,pos
sopir rekomendasi tawar bakpia beda beli coba laku pribadi suka nanas harum manis,pos
selera segar oven bakpia interior layan area parkir luas,pos
suka asli kacang hijau plombir bakpia lembut bakpia tekstur komposisi plombir cicip suka buka saksi proses produksi bakpia,pos
beli kotak tur bakpias produk lezat jual makan bakpia alim bagus,pos
suka suasana natural kuda bersih servicenya ramah relatif murah acara syukur keluarga anak neng definitely kesana lagiyeay,pos
kuda benarbenar jalan pawang damping kiri tinggal kekang jalan maju kanan belok kanan kiri belok kiri tenang percaya kuda lempar punggungnyasuasana tawar sungguh ndeso keliling pohon rindang pinggir sungai rebus ubi jagung minum jahe hangat teman canda ria sambut milik sambut ramah saudara gamel pawang kuda sabar komunikatif anak rewel berani kuda bonceng pawang berjagajaga buruk,pos
suka habis bbrp teman menungguwaktu stasiun bener nyaman alun musik lembut padu suasana bener homy,pos
tinggal phoenix hotel kamar letak bar vino bar dekorasi elegan lampu redup sofa nyaman tanda happy hour khusus duduk minum pesan kuno lychee martini layan penuh perhati musim puncak wisata bar hotel ramai bar bagus santai,pos
habis malam hotel sayap tulang tenggelam minum cepat berjamjam bar inikoktail lezat staf senang ramah benarbenar potong kue lilin nyanyi lagu selamat sayapengalaman hebat bar,pos
teman habis malam terbang koktail lezat unik bagus band nyanyi indahseperti dingin malam indah,pos
tarik batik cocok manja karya seni,pos
seni batik asli potongpotong,pos
lokasi becak opsi batik pria wanita harga saing mutu varian corak ukur ruang showroom tata udara belanja lebuh nyaman bayar debit card,pos
nyaman murah batik jenis batik ruang tunggu ac pegawai ramah kisar harga batik juta,pos
corak batik tradisional modern harga murah corakx ukur produksi batas toko worth,pos
kualitas bagus ruang ac nyaman belipengunjung betah harga relatif,pos
suasana toko homy meja tunggu model ragam batik printing anak dewasa model bagus mahal cocok diskon mantep,pos
kesana discount seru hunting batik model cantik cantik harga jangkau,pos
malioboro anter becak jual batik kualitas bagus harga gak mahal rumah batik mewah jenis batik variasi harga jangkau diskon,pos
sedia jahit rapi pakai batik ukur tantang harga mahal duduk,pos
supir taksi toko suka toko renovasi toko batik pria wanita anakanak,pos
batik model harga diskon letak istana raja sempurna,pos
batik kualitas model pakai tradisional modern suasana dekorasi staf ramah bingung beli batik beli batik,pos
harga kualitas batik toko tawar batik ragam kualitas harga beda ukur pria wanita anakanak aksesoris syal tas dompet desain,pos
batik harga tawar ragam tampil tantang quennie selusur batik cocok tawar harga bijaksana ekonomi,pos
lokasi mudah capai toko tawar kualitas pakai batik harga ragam lampik juta ukur lengkap,pos
bagus kualitas batik harga pakai kain kemeja blus interior tradisional jawa nuansa unik pagi hindar,pos
supir taksi masuk salah surga buru batik harga saing batik kualitas plus diskon kartu,pos
batik kualitas model pakai tradisional modern suasana dekorasi staf ramah bingung beli batik beli batik,pos
harga kualitas batik toko tawar batik ragam kualitas harga beda ukur pria wanita anakanak aksesoris syal tas dompet desain,pos
batik harga tawar ragam tampil tantang quennie selusur batik cocok tawar harga bijaksana ekonomi,pos
lokasi mudah capai toko tawar kualitas pakai batik harga ragam lampik juta ukur lengkap,pos
bagus kualitas batik harga pakai kain kemeja blus interior tradisional jawa nuansa unik pagi hindar,pos
supir taksi masuk salah surga buru batik harga saing batik kualitas plus diskon kartu,pos
saksi karya batik lukis indah karya tawan ramah layan batik sentuh hati,pos
suka batik layan ramah ragam luas galeri anak senang batik karya betah sukses,pos
galeri batik bagus kualitas batik lukis proses nyaman layan ramah batik seni batas,pos
layan friendly cepat memuaskankualitas produk bagus bgtbatik has good people good quality,pos
batik lukis bagus harga kualitas keren batik ownernya rama order mantap sukses trus batik,pos
rencana galeri lukis batik indah ramah ramah batik,pos
seniman kelas suka lukis batik indah ukur gaya manajer ramah bicara bahasa inggris lukis souvenir,pos
pacar toko lukis indah kualitas harga jangkau tinggal staf ramah bicara minum teh,pos
pandu keraton lukis indah suasana catton,pos
senang batik bagus batik seniman semangat kerja hebat browsing karya potong indah beli rekomendasi,pos
toko beli batik dansa tinggal staf ramah bantu bicara bahasa inggris toko batik tawar kelas batik harga,pos
banding harga toko adil variasi seni produk pakai,pos
bagus staf ramah lukis indah pakai batik syal harga masuk akal batik ajar mudah seniman karya seni,pos
kota batik batik batik ramah nyaman harga masuk akal,pos
batik benarbenar harga murah bangga rekomendasi libur budaya,pos
beli galeri batik seniman skala luas harga gabung workshop batik bagus,pos
suka indah ramah bantu rekomendasi,pos
lukis batik rumah hadiahsuvenir benarbenar margherita pizza seniman master batik gaya seniman tampil benarbenar penuh selera,pos
tawar batik eksklusif harga affordable malioboro toko kios pasar ring harjo harga senang belanja toko belanja paper bag cantik,pos
batik tulis harga jangkau kualitas nyaman strategis,pos
toko batik suvenir jalan malioborojika salah klasik kunjung terang toko bicara bahasa inggris ningrat adiningrat margaria soenardi toko kelas harga produk eksklusif variasi rancang sesak nyaman jendela belanja beli pakai toko soenardi keluarga teman batikpuncak danar had toko sempurna beli batik kualitas elegan harga kecewa,pos
driver jeep batu erupsi rapi bentuk emang unik alien nama batu alien batu alien kemaren trip pake jeep seklaian karna karna batu pandang lumayan bagus deket bunker rapi,pos
ik woon nu al een paar maanden en werd geadviseerd om hier eens een bezoek te brengen ik heb deelgenomen aan de silver school om mijn eigen sieraad te ontwerpen en daarna heb ik de zeldzame collectie binnen kunnen bewonderen zeker een aanrader voor een ieder die genteresseerd sieraden beelden het personeel ook super behulpzaam en alles vrijblijvend,pos
must visit chance see some beautiful silver being made buy quality handmade pieces staff just lovely there no pressure buy there amazing range traditional modern pieces,pos
habis maria area tamansari kraton borobudur tur jeep rapi kerawang workshop kotagede luas fleksibel murah hati informasi tinggal wilayah bantu bicara bahasa inggris rekomendasi,pos
pacar tur indah maria alin maria jadwal jalan cepat mudah pesan tripadvisor matahari terbit candi borobudur candi prambanan alin sabar jalan bantu coba tukar uang malam keliling candi plaosan gereja ayam gua maria jalan cahaya goa goa renang air terjun sri gethul senang hookups cepat kerumun maria alin jalan bantu kartu sim binatu bersih daftar makan sisa pikir pandu botol jalan maria mudah teman terima kasih maria alin bagus,pos
tripadvisor maria aplikasi kontak situs web untung jalan pemberitahuan alam pulau jawa tirai maria cocok wisata pribadi indah raya hidup budaya indonesia segar duduk lokal henti spontan bantu wanita tanam padi maria foto rekomendasi gabung mobil jalan ruang ramai js guesthouse alih kamar terima kasih maria indah kerstin matthias,pos
tur borobudur ganda pesan tur atur buang maria libur ramah inggris senang rekomendasi pesan terima kasih maria lihat,pos
tim dedikasi dukung jenis libur nikmat laku bayi remaja libur senang,pos
riri pandu wisata jalan budaya jawa bantu budaya lokal berita lokasi tawar pandang indah,pos
pesan tur prambanang borobudur sunrise transportasi pesan tur senang laku botol jalan kantor hotel wanita bagus bantu coba,pos
pandu maria bantu ramah sabar indah hati rekomendasi,pos
habis madu maria responsif makan malam bicara bantu,pos
maria pandu wisata teman pesan pandu jalan cepat rajin jalan preferensi borobudur prambanan,pos
indah botol marrrriaaaaa jalan indonesia komunikasi jalan maria cepat balas rencana jalan indah ahli,pos
maria pandu bahasa inggris jalan keluarga pintu masuk benarbenar terima kasih jalan senang rekomendasi aislinn agenof,pos
kantor atmosfer karyawan bicara bahasa inggris alahpahaman yhete jalan tawar giat harga jangkau sentuh pribadi,pos
hebat fantastis jalan indonesia fleksibel susun everythink kehendakk ramah senang terima kasih khusus maria erik rekomendasi temanteman,pos
kelompok wisatawan dengar maria agen pesan jalan borobudur pantai sumbi tim benarbenar nikmat indah pandang latar negara,pos
teguh eric pandu wisata inap jalan teguh hotel hotel bagus suasana makan tradisional klecem teguh eric,pos
barubaru jakarta borobudur jalan botol jalan indonesia maria indah rekomendasi agensy,pos
jalan mudah jalan jl prawirotaman bantu rekomendasi program fleksibel super staf informatif tur khusus fotografi,pos
jalan wisata botol fantastis penuh pandang takjub keruh matahari terbit henti benarbenar indah sopir hebat bantu backdoors,pos
pacar mobil sewa pantai selatan prambanan borobudur maria iwuk pesan senang mobil nyaman bersih sosial,pos
jalan ide harga adil bantu,pos
waktusama botol jalan pindul gua gunung rap pasir asrama jawa timur pantai pajitan harga masuk akal pandu ramah bantu benarbenar,pos
takjub jalan bottol habis jalan wisata manfaat wisata banding jalan pikir jalan,pos
jalan hidup kerja indah ramah temanteman jalan keluarga terima kasih,pos
libur jalan banding jalan indonesia murah layan ramah senyum langgan keluarga puas terima kasih jalan sejuk,pos
indonesia negara benarbenar indah jiwa terima kasih rumah ramah santai aman peduli,pos
libur jalan banding jalan indonesia murah layan ramah senyum langgan keluarga puas terima kasih jalan sejuk,pos
indonesia negara benarbenar indah jiwa terima kasih rumah ramah santai aman peduli,pos
bukit bagus sore jelang malam bukti liat kota lampu indah,pos
pandang cantik kota sangan cantik malam jaket dingin,pos
bukit bintang sore malam sore nikmat sunset malam lihat kerlip lampu takjub suasana romantis sejuk nikmat makan minum ringan jual,pos
cocok sore malam kelip cahaya lampu rumah makan sedia tinggal cocok pandang,pos
romantis pasang nongkrong teman asyik menu makan jangkau nikmat gemerlap cahaya kota suasana darat dingin pagi,pos
kota malam kelap kelip bintang langit indah tawan keliling makan tawar makan enak nikmat indah kota malam alam senang back nature,pos
tertentusilahkan dateng bukit bintangbagus malam haridi jejer warungdengan view indah malam,pos
puncak bogor beda gak sedingin ahrga makan jual murah nikmat karna makan patok harga nikmat pandang sewa,pos
