review_body,review_rating
ijo kota temu google maps mobil pribadi sewa sepeda motor mobil transportasi jalan candi ijo bahaya kota,neg
jalan situs sejarah bukit kuil kabut pandang kota,neg
bayar hidung jalan indah aithough tuntun penuh lubang puncak aman tinggal terlamba jalan nyala,neg
hidung pandang kota ganti hidung bayar biaya masuk,neg
jyoja kewisatawan situs matahari benam sayang awan matahari benam hotel bukit indah anak lembah,neg
candi ijo tanah nikmat hampar sawah matahari benam pandang matahari benam bantut,neg
jyoja kewisatawan situs matahari benam sayang awan matahari benam hotel bukit indah anak lembah,neg
candi ijo tanah nikmat hampar sawah matahari benam pandang matahari benam bantut,neg
candi kalas pinggir jalan jalan jogjasolo prambanan arah candi kalas letak kiri jalan candi jalas pinggir jalan banding candi prambanan plaosan candi boko,neg
candi jalan raya akses angkut kesana tahap pugar,neg
hallo advisor inimau bahas objek wisata kota candi kalas candi bening candi umat budha letak kalas deket rumah stupa jarak candi prambanan venue wajib kunjung lhoh administrasi laku masuk candi kalas parkir kelola warga bentuk candi junjung indah foto abadi recomnded tovisit jas merah,neg
jarak candi prambanan tepi jalan raya soloyogya masuk lokasi meter candi candi kalibening letak desa kalibening candi dewi tara prasasti kalas panangkaran wangsa syailendra hormat dewi tara candi budha tua populer candi prambanankelihatan fisik canditaman lanskap awat baiksaat tanggatangga besi kerja renovasi selatan utara bekas pohon tumbang candi resto ayam goreng kalas candisari mbok rek kenal candi,neg
candi kalah pamor candi prambanan sayang candi perhati sangata jalan raya,neg
candi kalas letak jalan solo letak meter jalan solo timur bandara jalan candi candi julang biaya akses masuk lokasi candi murah rupiah,neg
candi puja dewi tara tepi jalan indah halaman candi sempit senang candi turis ramai lokasidi pinggir jalan,neg
candi kalas candi budha puja dewi tara candi panangkaran dinasti syailendra atap candi hancur faktor usia tunggu pugar selamat unjung unjung kenan masuk badan candi pintu,neg
candi kalas hormat bodhisatva tara mataram kuno mudah letak jalan utama hubung kota kota solo jarak jalan kendara motor candi prambanan,neg
salah candi candi kawasan candi sulit gang area candi,neg
candi kalas letak jalan solo hadap rumah sakit polri bhayangkara sembunyi rumah pohon lokasi meter jalan raya candi kalas candi tunggal candi stupa,neg
masyarakat pinggir kalibening kalas sleman candi prambanan kisar kendara motor kalas arah kota perlahan ujung candi jalan raya meter jarak candi arsitektur,neg
candi jalan raya solo lokasi strategis mudah jangkau letak pinggir jalan sayang saksi megah candi tinggal lampau,neg
candi letak pinggir jalan raya solo arah prambanan sulit candi letak pinggir jalan tinggal lihat arah turn left candi rumah warga jalan turun parkir parkir,neg
kompleks candi prambanan kanan jalan candi kalas pinggir jalan candi halang pohon lebat suasana redup candi redup suka,neg
tinggal budaya hias jalan raya prambanan kendara henti kenal candi hindu budha,neg
candi megah publikasi perintah daerah tenggelam populer candi prambanan kawasan area kalas prambanan,neg
bangun ny udh hancur dn tidk mncrminkn objk wisataa,neg
bagus turun tua merinci,neg
kuil letak desa kalas prambanan kilometer kuil ramai banding candi borobudur candi prambanan unjung lokal,neg
kuil borobudur jalan jalan jalanjalan tiket,neg
foto hotel megah ukur buruk masuk struktur,neg
jalan candi borobudur layak henti kusir tuju kepala prambanan interiur buddha indah,neg
kuil borobudur jalan jalan jalanjalan tiket,neg
foto hotel megah ukur buruk masuk struktur,neg
jalan candi borobudur layak henti kusir tuju kepala prambanan interiur buddha indah,neg
candi prambanan jalan arah utara candi candi prambanan slaah candi lumbung candi budha prambanan candi hindu beda komplek lokasi bentuk lumbung renovasi sejarah candi prambanan sejarah candi lumbung,neg
candi lumbung bentuk lumbung bangun simpan padi bangun gugus candi bangun candi utama candi wara halaman kompleks candi tutup hampar batu andesit tangga pintu masuk letak timur pintu masuk lengkap bilik tampil lorong ruang tubuh candi dinding utara barat selatan relung arca relung buah arca hancur candi wara arah candi utama candi tawan wisatawan,neg
sejarah lampau gigih kerja keras nenek moyang candi kokoh nikmat abad,neg
letak kompleks candi prambanan duduk lumbung beras temple nasi sawah renovasi foto candi sewu,neg
murah kawasan candi harga tiket masuk murah posisi candi area parkir letak pinggir jalan mudah nikmat candi plaosan jalan kaki,neg
mengukuti trip prambanan candi kunjung ramai puas foto candi candi masuk,neg
rencana isi libur hut ri keluarga jalan jalan candi plaosan keluarga surprisehari masuk candi gratis hut ri sangkahadiah,neg
explore obyek wisata singgah wisata belanja wisata alam wisata budaya salah wisata budaya wajib wisata candi candi plaosan situs budaya,neg
lokasi candi prambanan prambanan arah klaten jalan bagus bangun candi suka secrowded candi prambanan borobudur parkir tinggal jalan nyampe candi,neg
denah candi indonesia bentuk bujur sangkar denah persegi candi plaosan agama buddha kompleks candi plaosan lor utara plaosan kidul selatan jarak kilometer candi,neg
candi plaosan salah candi candi prambanan ngak masuk candi event jihw jalan sehat masuk kompleks candi prambanan,neg
candi letak klaten rada pusat kota candi potensi wisata sejarah perhati perintah masuk candi tiket bayar jaga rporang salah,neg
lokasi kompleks candi prambanan kompleks prambanan kendara jalan kaki kelola,neg
letak candi prambanan tiket murah banget parkir aneh unjung relatif sepi lokasi gak prambanan worth wisata sejarah gak ramai,neg
lokasi candi plaosan lor kidul candi prambanan sepi unjung jalan kaki capai candi area parkir rumah duduk suka candi lantai suasana,neg
rumah pacar lokasi ujung utara jalan candi sewu rumah sepeda timur rang candi beranta candi awat,neg
candi plaosan salah candi budha kabupaten klaten daerah istimewa candi pikat zaman raja medang mataram kuno wangsa sanjaya kendati pikat anut agama hindu isteri pikat pramodya wardhani anut agama budha,neg
megah ramai bagus suka photografi lokasi candi prambanan mudah jangkau,neg
letak candi prambanan kompleks candi plaosan area plaosan kidul plaosan lor plaosan kidul bentuk candi plaosan lor bentuk candi candi plaosan candi agama budha beda prambanan,neg
anakanak jalanjalan pagi lepas shubuh main rumah temen kuliah manisrenggo yesss pagi wisata candi target candi plaosan candi sambisari candi plaosan candi prambanan bagus nikmat sunrise,neg
konon candi plaosan berkah pasang mendapatlkan mohon harap pasang harap,neg
candi prambanan jalan timur nikmat salah tinggal candi buddha daerah candi tenang hati seru sepeda tiket masuk salah isi buku tamu,neg
salah objek wisata candi buddha wajib kunjung plaosan candi vajrayana simpan misteri indah seni,neg
salah bagus objek hunting fotosemua bagus moment,neg
candi jarak kompleks candi prambanan suasana kompleks candi sepi jarang wisatawan candi kalah megah candi prambanan candi suguh pandang sawah indah akses jalan,neg
obyek wisata obyek wisata kenal candi plaosan alternatif tuju wisata patut timbang letak batas provinsi jawa candi plaosan kompleks candi buddha pikat wangsa sanjaya,neg
pikir lokasi lokasi candi prambanan guide area candi prambanan candi area candi kenal,neg
candi pagi gues what magical suasana mistik kabut plus langit warna jingga runtuh candi pohon atmosfer kusyu,neg
galib candi caloncalon doktor anthroplogi seni obyek wisata limut ilmiah,neg
prambanan jalan kaki takjub ramai candi prambanan jalan runtuh gambar,neg
kompleks candi indhuist utara selatan jalan keduabagian selatan,neg
dolar kuil pikir plaosan temple makan cts layak,neg
angkor minat runtuh konstruksi kompleks candi prambanan foto utuh,neg
kuil kagum arsitektur jatuh candi turis makan siang jalan kuil takjub sawah hijau,neg
candi prambanan arsitektur pura kompleks candi prambanan layak daerah candi prambanan hidung ratu,neg
suka tari ramayana prambanan purnama coba plaosan matahari benam ponsel kamera gambar kompleks jalan,neg
indah jalan sawah plaosan cuaca ubah transportasi aman bantu tumpang ramai prambanan investasi daerah,neg
ramai candi ruang nikmat ukir patung rumit candi hindu kuno taman hijau indah,neg
slighlty kompleks candi prambanan arsitektur batu,neg
kuil curam jalan kaki rekomendasi pagi hindar ramai tur sekolah lokal panas siang,neg
istirahat kuil banding candi prambanan biaya masuk alam sawah hijau bagus,neg
buddha kuno kuil hindu salah situs web candi bentuk arsitektur beda teman beda pintu gerbang kanan kiri kuil,neg
untung cuaca kabut awan matahari terbit kuil rekomendasi,neg
kuil bagus sawah jalan pendek bagus kompleks candi prambanan arsitektur sejarah,neg
kuil salah tua awat konstruksi bagus suround kuil bagus,neg
obyek foto bagus pagi malam panas mei,neg
bagus foto payung topi panas jalan,neg
indonesia salah kuil salah populer somethimes angkor,neg
kuil daerah istimena plaosen bosan habis staf kuil daerah tumpuk batu tua,neg
mudah kompleks kuil kuil lokal benarbenar jalan,neg
kuil hotel lokasi lari candi prambanan kompleks tiket masuk,neg
candi sopir taksi lokal salah senang ramai kuil kunjung jalan jelajah gambar,neg
kuil indah bagus ramai situs bayar biaya masukdonasi jalan situs struktur runtuh tanah percaya,neg
benarbenar gunung rapi rusak gempa bumi kompleks kuil kesan benarbenar layak biaya masuk rendah banding prambanan,neg
kuil indah bagus ramai situs bayar biaya masukdonasi jalan situs struktur runtuh tanah percaya,neg
benarbenar gunung rapi rusak gempa bumi kompleks kuil kesan benarbenar layak biaya masuk rendah banding prambanan,neg
salah candi keraton ratu boko candi erlalu pusat kota foto bagus dtang subuh foto sunrise,neg
niat sunset sayang sore turun hujan siang panaaass sunset tuju sunset bentuk candi runtuh bangun batu tua,neg
sore nikmat sunset rombong keluarga tua anakanak remaja suasana rame maksimal foto pandu sejarah candi,neg
candi ratu boko beli tiket candi prambanan candi ratu boko minibus candi prambanan lokasi candi ratu boko jalan kelok tanjak keliling pohon julang candi populer suguh pandang,neg
istana latar pandang matahari benam terbit hadap santai rumput hijau efektif bilah tiket candi prambanan,neg
candi ratu boko hits lokasi shooting film cinta sejarah keraton ratu boko gagah sayang keluarga mendung jelajah pelosok candi ratu,neg
asik na selfie site na banyakin pohon susah nyari teduh klo just selfie,neg
sore sunset untung arah parkir paruh jalan keliling kawasan candi boko daerah gua turun pos awas,neg
candi luas bangun candi pugar lengkap bangun candi lokasi bagus liat sunset siangsiang baju hitam panas topi hitam gak silau,neg
lihat bentuk desain candi beda bentuk candi istana keraton batu bangun hancur bekas megah,neg
area lelah tua area candi tumpuk foto,neg
misteri rasal candi candi horang kaya,neg
locasinya candi prambanan walo masuk desa rugi historical favorit lokasi bekas pinru gerbang istana cinta senja sunset recomendet bangett lokasi sore ramai unjung,neg
dont afraid bring your baby here ratu boko nice view just litle hot its bukti anak bahagia running field at ratu boko sepatu btw gt suka sejarah bosan,neg
salah bagus nilai sejarah bagus matahari benam sunset lokasi bukit wajib candi prambanan bekas istana tilas bangun,neg
gak rugi runtuh candi ratu boko kraton ratu boko siang panas bayar megah kraton ratu boko konon bagus nikmat runtuh ratu boko sunset,neg
jalan candi ratu boko berangkat sore hotel prawirotaman walhasil sore driver ngebut gak keburu harga tiket masuk masuk hrs,neg
kesana sayang mendung sunset bagus pandang indahh ngga pusat kota,neg
sunset sayang langit awan,neg
candi ratu boko tuju salah sejarah,neg
konferensi teman bekas keraton ratu boko candi dieng lokasi habis daki bukit kompleks keraton sangka komplek keraton luas bukit,neg
kompleks candi tata resto gardu pandang taman bagus awat salah view sunset bagus sore ideal nikmat kawasan candi ratu boko,neg
letak candi ratu boko candi prambanan yogyakartaanda nikmat makan malam sembil nikmat tenggelam matahari ufuk barat,neg
bagus hitam topi panas pandang bagus pandang candi pramabanan gunung rapi,neg
wisata candi ratu boko bayar tiket prambanan ratu boko candi boko topi air cuaca panas sore candi bagus pandang,neg
candi boko letak diy kota solo daerah candi prambanan belok kiri arah kendara pribadiroda pintu masuk bayar masuk puas candi boko,neg
bagus foto sunset recomended pintu jalan jalan kaki,neg
top pandang worth jos jos panas kesana siang gosong bagus emang kesana shuttle berangkat prambanan gak kendara gak susah bagus foto asi jelang sunset kesana,neg
candi raya lebaran sungguh penuh juang macet parah untung kendara beca jalan pintas hemat candi luarbiasa sore matahari benam pandang keliling,neg
kompleks candi bekas istana ratu boko tata rapi bagus bersih wisatawan nikmat enak duduk istirahat jalan lelah nikmat pagi panas sore nikmat,neg
pandang bagus fasilitas lengkap toilet bersih mushola cafe warung sedia informasi lengkap sejarah candi ratu boko,neg
capai kendara pribadi jalan lintas kampung warga repot tinggal duduk tour travel candi prambanan,neg
dateng candi borobudur kesana ratu boko ciri khas candi jalan tanjak situs budaya hindu,neg
lokasi sulit kendara kendara letak bukit jalan curam tikung prambanan tiket kesana bis bongkah runtuh candi,neg
candi prambanan lengkap anjur kendara lokasi jelang maghrib suasana matahari tenggelam mistis bosa nikmat sholat maghrib sedia bersih,neg
kota hunting sunset kompleks candi ratu boko candi pandang luas arah kota matahari benam sinar kuning emas,neg
wisata candi ratu boko pakai warna hitam topi lokasi panas teduh sampe pingsan panas lalai lokasi bersih luas sejarah candi,neg
candi ratu boko salah obyek wisata favorite historical lokasi enak nyaman fasilitas unjung bagus bagus obyek foto tiket mahal parkir luas,neg
medan tanjakterjal tantang obyek wisata bukit bakadusun gunungsaridesa sambirejokecamatan prambananyogyademikian akses pintu loket site tangga stamina fisik fit harga tiket relatif mahal parkir tiket masuk jamsampai,neg
pagi matahari terik candi luas renovasi papan bantu pakai topi payung terik matahari kepala,neg
temanteman buru sunset turis lokal harga tiket flat turis asing tarif sunset mahal,neg
tuju prambanan beli tiket ratu boko murah kompleks prambanan prambanan luas siang panas candi bayak tinggal,neg
hotel daerah malioboro sore jalan kesana jalan kesana bagus mobil motor harga tiket masuk wisatan domestik wisatan international harga ramai,neg
candi ratu boko alam candi sari matahari benam,neg
beautiful sunset from candi ratu boko candi ratu boko sore pagi skali karna sunset sunrise bukit sesal good view good place good friends,neg
lokasi bagus liat sunset sayang awan lihat cafe santai sayang area parkir batas parkir susah,neg
candi ratu boko salah candi jalan candi prambanan,neg
informasi keraton ratu boko misteri tiket masuk murah restoran harga cocok kantong turis domestik enak view bagus sayang kesana keluarga,neg
capai sulit kendara nikmat kompleks bangun kuno tinggal pondasi latar megah kompleks istana lokasi,neg
darang kemaren ubah lapanangannya hijau pugar dilakukann ganti batu pecah kemaren dengar keluh tourist backpack,neg
bingung candi ratu boko beli tiket candi prambanan sedia shuttle candi ratu boko untu objek wisata kagum detail,neg
candi ratu boko hancur bangun akibat gempa masuk bagus foto iti mubgkin bangun batu batu candi hancur bentuk batu asli,neg
salah tinggal sejarah wajib bukit lokasi candi prambanan,neg
gemar sunset salah istimewa runtuh candi dramatic saksi megah candi prambanan malam saksi langit merah matahari tenggelam kota,neg
obyek matahari tenggelam indah luas penuh makna sejarah sayang puas sore eksplor site lengkap puas,neg
candi prambanan bus khusus shuttle candi ratu boko ratu angsa jalan awan bentuk angsa hehehehe sepatu hak capek,neg
candi demam film cinta duga ramai pekan pandang indah candi letak bukit foto sunset maksimal tutup,neg
soresore jalan sayang sunset sahabat awan mendung bayar tiket murah tiket reguler sunset tiket bayar buru sunset,neg
akses ratu boko susah worth kesana acara nikah gituternyata bagus acara nikah foto dar dudukduduk santai pokok ratu boko note,neg
candi ratu boko pake tiket bayar udah jalan liat candi prambananboko view bagussejukbersih kelola liat sunset candi ratu boko,neg
candi jaring candi prambanan candi borobudur lokasi candi prambanan candi ratu boko nikmat pandang kota salah candi prambanan,neg
candi stamina prima jalan turun senang sore udara panas lokasi relatif candi prambanan kendara,neg
jalan candi ratu boko arah rute candi prambanan jalan raya solo candi prambanan belok kanan jalan lengkap candi rato boko jalan sempit tanjak sedia parkir,neg
mistis sejarah milu tragis ngobrol duduk lokal,neg
jalan candi prambanan wisata kraton ratu boko jalan lintas desa lokasi keaton bukit pandang indah kraton sdh tinggal gerbang puing puing bekas kraton konon hancur akibat letus rapi,neg
beautiful place great view matahari benam sunset ratu boko unjung sayang sekuriti unjung tinggal lokasi sunset benarbenar tutup,neg
januari kmarin keluarga wisata keraton ratu boko pandang eksotis misteri dtemunya lempeng nabi sulaiman ratu bilqis mandi putri sisa candi borobudur smakin misteri takjub pandang alam,neg
ratu boko lokasi bukit beli tiket loket candi prambanan lokasi bangun candi bentuk peta wisatawan mengirangira bentuk lokasi candi lokasi lumayan tanjak,neg
lokasi panas akses susah topi bekal candi bagus candi prambanan borobudur,neg
candi ratu boko bagusjika banding prambanan borobudur candi ratu boko bentuk rentuhan bangun candi utuh bentuk candi ratu boko jelang sunset,neg
candi prambanan candi ratu boko lokasi prambanan bentuk candi indah prambanan lolasinya pandang sunset hunting coba makan,neg
candi ratu boko letak candi prambanan akses kendara prambanan jalan soloyogya candi bukit mdpl kawasan sleman bantul klaten,neg
candi prambanan singgah kraton candi boko letak betapa mebel ticket masuk kompleks kraton jalan lumayan capek tanjak hampar,neg
candi ratu boko salah destinasi nikmat sunset akses candi ratu boko sulit tinggal masuk candi prambanan beli shuttle ratu boko kendara,neg
sgt bagus study tour ygenerasi bsa sejarah cikal kraton boko candi bokotempat bdoa agama seharuslbh bnyk tanam pohon teduh hgga terik panas,neg
seruuuukerennn gg trbyang excited bngt prtma dtng dri prjlanan aj sdh gg sbar smpe sna bgus bngt viewaad brbgai pninggalan dn misteri mnutupi dsna dsna dlrang mmakai rok mini hot pantstp khwatir sdh trlnjur pkai mini dsna,neg
candi ratu boko beli tiket ratu boko prambanan lokasi prambanan mobil sedia kompleks candi prambanan komplek,neg
candi ratu boko salah candi letak bukit ratu boko sembah matahari candi bukit candi ratu boko mudah pusat kota,neg
nikmat matahari tenggelam barat pantai kraton ratu boko suguh sunset indah pesona daei sore tunggu matahari tenggelam foto latar pohon batu candi rumput hijau bukit,neg
candi megah salah candi bukit selatan candi prambanan candi istana mandi pintu gerbang gerbang istana jalan jalan tanjak curam pintu arah selatan,neg
salah tinggal sejarah libur kota gudeg jarak tempuh area kota tempuh kendara roda shutle bus sedia candi prambanan area parkir,neg
istana inianda damai pandang kota candi prambanan latar gunung rapi sumur penuh misteri jalan arah tenggara candi pembakarankonon amerta mantanayang air suci mantraair sumur,neg
sesat masuh bayar candi bukit sore foto sunset latar candi prambanan latar mandi zaman raja keliling candi ratu boko sensasi,neg
candi boko situs purbakala kompleks sisa bangun kirakira selatan kompleks candi prambanan timur kota zaman raja mataram hindu abad,neg
matahari tutup awan pandang jelang sunset bagus suasana candi nyaman jalan kaki piknik biaya sore harga ubah,neg
baca referensi ratu boko rumor nabi sulaiman pindah istana ratu bilqis istana istana ratu bilqis deket prambanan candi ratu boko dihubunghubungkan siy asyik,neg
bus transjogja malioboro murah halte prambanan jalan candi jalan kaki betor becak motor beli tiket candi prambanan candi ratu boko prambanan,neg
candi ratu boko sulitbila candi prambanan beli tiket candi ratu boko mudah jalan candi prambanan candi ratu boko,neg
lokasi gunung keraton pandang sayang lokasi prambanan sejarah studi,neg
candi letak candi prambanan selatan prambanan lokasi bukit kendara tanjak jalan lumayan terjal arah candi konon candi istana ratu bilqis nabi sulaiman,neg
candi ratu boko situs purbakala bukit lokasi bis trans tarif jalan inap pusat kota laku mudah,neg
beli tiket masuk candi prambanan shuttle bis candi prambanan transportasi pribadi candi letak bukit pandang indah jalan pintu masuk,neg
agustus teman teman sdsmp candi ratu boko rangka reuni tama situs prambanan borobudur salah sangka dengar,neg
candi ratu boko candi prambanan lokasi kirain deket ter sodarasodara turun gunung seru smpe jalan candi objek ktnya bagus,neg
kompleks candi tiket beli tiket masuk prambanan droppick service prambanan runtuh kompleks candi luas prambanan keliling dampar,neg
kompleks candi ratu boko bosan kunjung luas limut misteri referensi ahli,neg
candi letak area candi prambanan candi kalas lampu merah candi prambanan belok kanan rel kereta rel kereta kiri gang masuk kampung jalan tajak gear mobil avanza tumpang,neg
candi ratu boko kompleks keraton kuno sisa bangun indah tawan kelola fasilitas lengkap bangun gapura pintu masuk kompleks keraton bangun aula istana mandi putriputri,neg
jalan komplek ratu boko tanjak kendara pintu gerbangmasih jalan meter candi jajal kiri kota tinggibahkan prambanan,neg
candi ratu boko populer anak anak perempuan suka istana boko nikmat sejarah arsitektur kuno trekking sunset pandang susensetnya kota prambanan indah,neg
ratu boko tempuh jalan desa prambanan motor ratu boko kompleks candi restorasi padang rumput luas kompleks candi candi,neg
kompleks ratu boko memliki pendopo keputren kolam mandi taman sari keraton jujur simpan misteriaroma mistis jelang sore sore area candi kosong unjung,neg
kompleks candi ratu boko luas nikmat lokasi kompleks sejarah bosan suasana pagi matahari terbit matahari benam,neg
salah candi sejarah indonesia kagum pendahulutempat kilo meter candi prambanan tiket loket masuk candi prambanan transportasinyasepanjang jalan candi boko masuk,neg
kawasan ratu boko sore matahari tenggelam ufuk barat suasana megah bangun kawasan,neg
candi ratu boko salah candi banding saudara candi prambanan candi sewu candi ratu boko komplit lari hingar bingar kota sembari kagum arsitektur sejarah nikmat senja cantik sore,neg
pribadi masuk kawasan candi boko masuk kawasan letak candi wangsa sailendra panangkaran raja medang mataram hindu bukit bentuk bangun,neg
letak gak prambanan masuk parkir mobil jalan nanjak datar mentok mobil parah suv sore liat matahari benam,neg
jarak tempuh lokasi jalan kaki tangga dating kesana kai sore hamper sunset terang saying sunset tutup awan mendung foto siluet gerbang candi ratu,neg
kompleks candi ratu boko alam senang candi candi prambanan beli tiket sedia kompleks candi kompleks candi luas jumpa proses gali temuantemuan,neg
masuk gerbang ekspetasinya sambut free air mineral udah bayang jalan neh masuk dalem bagus sewa guide ngerti sangka anak betah ngeliat hampar rumput,neg
putus asa masuk kawasan ratu boko ternyataa keren prewedd,neg
peduli kamera potret sunset tur situs sejarah gelap matahari benam moga sedia lampu matahari benam,neg
istana ratu hidung salah matahari benam hotel letak bukit pandang kota btw tiket masuk matahari benam mahal normal,neg
sayang rampok indonesia hotel harga online bayar tiket makan malam kopi,neg
kuil duduk wisatawan asing sedih restoran kecewa minum manis makan foto menu pandang,neg
pandang matahari benam atraksi watch out gunung rapi jalan pandang lihat foto,neg
daerah sejarah borobudur candi prambanan pandu sedia pintu loket harga utuh lengkap kompleks istana ratu hidung sedia restoran pandang indah,neg
situs sejarah raja jawa abad bangun objek wisata gerbang masuk kompleks daerah restoran duduk tunggu sunset nikmat kopi jalan kompleks lelah,neg
istana ratu hidung kuil sesat ibadah situs sejarah indah pesona sayang informasi fakta nyata pandu wisata sedia bagus foto,neg
pelihara daerah arkeologi indonesia kecuali nilai kuil ssecond benarbenar alam matahari alam indah gembira matahari,neg
ratu hidung salah kuil area matahari benam kenal sayang sunset siang ratu hidung layak,neg
pandang matahari benam ratu hidung kerumun turis jalan runtuh kuil hindu kuno lokasi kota ratu hidung derajat candi prambanan ratu,neg
candi hindu kuno rekomendasi pandang matahari benam matahari benam nikmat makan malam restoran pandang lembah titik kuil prabanan,neg
salah rugi bagus matahari benam gegas malam awan jalan tangga lutut hindar,neg
kompleks candi bagus runtuh kuil candi borobudur prambanan kenal serama,neg
ratu hidung akses candi prambanan beli tiket shuttle letak prambanan ratu hidung benarbenar jalan situs lihat papan informasi,neg
situs penuh misteri kagum kuno tradisi kaya,neg
kuil capai tangga kuil jalan kaki bayar biaya masuk jalan kuil kuil pandang,neg
tunggu matahari benam cuaca awan santai,neg
borobudur candi prambanan ratu hidung waris jawa borobudur gratis prambanan beli ratu hidung tiket masuk ratu hidung liar sayang awat,neg
candi borobudur prambanan rekomendasi keraton ratu hidung daftar istana templa lokasi candi prambanan packagee legenda keraton hidung,neg
struktur kesan angkor wat kecewa tiket mahal mahal angkor wat kecewa coba transportasi,neg
kuil lokasi pandang kafe kompleks,neg
pandang matahari benam candi ratu boko runtuh batu sejarah nilai harga,neg
