review_body,review_rating
plaosan kompleks candi buddha luas candi kembar candi utama ukur stupa arca reliefrelief cantik candi sepi unjung nikmat,pos
candi kembar candi plaosan letak prambanan sayang ramai candi pandang indah sawah sejuk tempuh candi prambanan,pos
tapak kekayaaan budaya jawa indonesia dibenahidirestorasi candi keren,pos
letak desa plaosan candi candi plaosan sangal candi tinggal jarak meter lokasi candi plaosan iniwalaupun jawa keluarga pulang kampung,pos
candi candi kembar utama indah rumput hijau candi foto candi bangga lihat teman kesana pugar arcaarca candi rusak candi arca,pos
jalur turis bagus biaya masuk murah rupiah runtuh kuil indah set turis bagus foto benarbenar layak,pos
pasang kuil indah bagus layak nyaman jalan bandara pusat kota prambanan jalan,pos
kuil plaosan candi prambanan kompleks utama candi plaosan bagus layak pendek anggun utama,pos
plus kuil prabanam indah desa biaya masuk turis ujung utara selatan kompleks bagus foto graphy minus,pos
plaosan candi kembar tenang batas yogjakarta klaten letak utara candi kalas suka hubung candi sawah,pos
kuil candi prambanan candi kembar tampil utara selatan candi plaosan arsitektur spektakuler kagum lihat itineraray candi layak,pos
indah damai releifs indah turis borobudur,pos
tenang prembanan santai indah suasana,pos
kuil buddha patung avalokiteshvara bagus biaya masuk murah prambanan nikmat hampar sawah kuil bagus suka hotel,pos
lempar batu candi prambanan kenal permata arti situs web berabadabad layak santai,pos
letak candi prambanan nikmat sunrise indah senang pagi,pos
kalang asing favorit kuil datar keliling sawah magis suka percaya tiket masuk gratis supermurah,pos
kuil kuil buddha raja hindu agama buddha ratu ibadah patung buddha takjub runtuh rubah,pos
gaya unik jalan meditasi,pos
candi pulau jawa suasana tenang sunyi foto suka alam,pos
kuil sore matahari benam damai indah letak tepi dasar matahari benam keluarga,pos
candi prambanan kenal situs web plaosan awat layak drive takjub,pos
benarbenar suka temple pandu arkelogis utara spektakuler selatan,pos
gemar sunset siluet kasih rekomendasi kuil,pos
candi ukur ukir pintu gerbang tembok dengar pramodhawardhani pikat raja ratu jawa century batu roboh temple jalan situs arkeologi membangkruntukan,pos
senang kuil letak prambanan kelompok wisata hotel tenang indah henti,pos
letak plaosan candi prambanan candi umur rekonstruksi indah kawasan total plaosan kuil,pos
candi prambanan kompleks khusus candi utama kompleks contoh hindu tampil jawa,pos
makan renovasi sayang,pos
kuil plaosan kompleks kuil buddha jarak kilometer barat laut candi prambanan wyden sayang potong arsitektur takjub struktur puncak indah suasana tenang keliling sawah,pos
pramaban coba situs kuil plaosan sepeda motor sulit bujah beras paddys banding prambanan layak utama kuil,pos
indah tenang spiritual eksplor nikmat duduk meditasi fasilitas dasar tinggal matahari benam,pos
kendara kompleks prambanan keliling sawah tawan tawar panorama bagus suka suasana sepi tenang iess menara hancur batu jalan candi,pos
prambanan plaosan penuh sesak turis prambanan anakanak sekolah kelas jalan senang plaosan,pos
prambanan jumat unjung libur damai kunjung matahari benam sawah tinggal kuil foto cantik,pos
prambanan sewu kesan prambanan hujan turun kesan indah tenang area prambanan kendara gratis masuk,pos
daerah senang bayar snack bar pintu masuk aman hujan rintikrintik pandang indah,pos
kuil indah kompleks kuil pintu masuk mahal bayar bayar lumayan uang bantu,pos
kuil bangun runtuh indah sore cerah musim hujan desember,pos
candi gunung rapi prambanan indah layak bayar biaya masuk daftar pintu masuk rekomendasi candi gunung rapi prambanan,pos
abai salah kuil indah jawa alam desa terna indah,pos
mei tenang peluang santai halaman jelajah kuil situs harap pusat sejarah google maps,pos
prambanan sewu kesan prambanan hujan turun kesan indah tenang area prambanan kendara gratis masuk,pos
daerah senang bayar snack bar pintu masuk aman hujan rintikrintik pandang indah,pos
kuil indah kompleks kuil pintu masuk mahal bayar bayar lumayan uang bantu,pos
kuil bangun runtuh indah sore cerah musim hujan desember,pos
candi gunung rapi prambanan indah layak bayar biaya masuk daftar pintu masuk rekomendasi candi gunung rapi prambanan,pos
abai salah kuil indah jawa alam desa terna indah,pos
mei tenang peluang santai halaman jelajah kuil situs harap pusat sejarah google maps,pos
lokasi unik rawat fasilitas lokasi bsa,pos
jalan raya biaya mahal indah indah matahari benam,pos
siang panas bagus foto foto makan degan kelapa muda warung warung,pos
jelang sore sunset candi ratu boko mnyajikan pandang alam indah kota bukit tatanan taman indah segar cocok tamasya teman keluarga,pos
wisata mengunjugi situs ratu boko letak prambanan mengkases konecting situs candi prambanan bis sus wisatawan parmbanan candi ratu boko pandang indah twrdapat,pos
cocok matahari benam foto bagus nyanyi jawa suguh seniman matahari benam bayak duduk barat sembari indah matahari benam,pos
candi halaman luas explore ujung candi,pos
kalas beli tiket gabung candi prambanan tiket biaya candi prambanan candi ratu boko,pos
candi ratu boko tawar sensasi canti beda candi borobudur prambanan hunting sunset pasang indah,pos
nikmat sunset romantis kaki pulang lembayung pancar pesona sungguh betah,pos
capai salah alam tenang sejuk positif cuaca sejuk diam,pos
keren view mantab jiwa lihat candi ratu boko sink payung siangsiang panas buk,pos
candi bersih tata miliar view gunung rapi merbabu candi prambanan anak suka suka turun tangga candi sejarah sungguh manfaat,pos
candi borobudur candi prambanan transportasi pandang sore bagus keren tawan restauran duduk duduk manja pasang suap suap romantis ko hehehehe,pos
kesana libur temen suasa asri pandang bagus bagus sunset recomended sunset bersih candi jaga,pos
candi sempurna mahakarya nikmat indah budaya indonesia candi dukung fasilitas lengkap betah candi selamat,pos
sore kaget haga tiket salah view sunset gate ratu boko legendaris super indonesiaaaa ngeliat prambanan,pos
destinasi piknik keluarga candi ratu boko wisata alam wisata esukasi sejarah cabdi ratu boko rakyat luas tamantaman musik tradisional,pos
candi boko istana megah pintu gerbang utuh megah bukit candi ratu boko bagus wisata sejarah panorama sunset indah candi prambanan,pos
nikmat alam nikmat sunset indah pantaijangan ratu boko sungguh cantik pandang sore romantis pacar,pos
candiharga klw slhitu sdh anter candi pake bussebenernya candi bagus uniktapi sayang gak kesinitempat sepi jarang pengunjungtapi candi unik,pos
candi ratu boko nikmat suasana candi sore hoki dapet sunset aahh keren poko,pos
maret candi ratu boko entrance fee transport kesana beli paket entrance fee candi prambanan pandang keren kesana pagi siang panas,pos
letak bukit candi prambananbisa pandang kota nampak indah kunjung sore jelang senja,pos
candi view pesona area luas jaya milir sejuk angin nyaman,pos
candi ratu boko utuh taman runtuh candi runtuh candi pesona sunset seluet candi indah foto tiu sore penambilan budaya lokal,pos
kenal candi prambanan borobudur candi unik suguh pandang indah bukit,pos
main wajib hits kaya karna cinta hahahaha tiket masuk kaya masuk candi prambanan mobil lokasi candi super duper luas,pos
candi indah khusunya sunset sedia restoran foto lokasi luas rumput segar historic esthetic,pos
tiket masuk candi ratu boko beli loket candi prambanan harga pake mini bus prambanan jalan tanjak degdegan amazing bersih sejuk nilai sejarah keren foto,pos
jujur film candi bagus proses pugar perapihan biaya masuk mahal fasilitas musholla makan sedia candi kesana cuaca,pos
candi ratu boko nyaman sore untung sunset foto keren,pos
lokasi komplek candi prambanan candi ratu boko bukit liput objek pandang indah sore cocok sunset restoran nikmat senja,pos
sunset keliling candi kumpul gerbang candi ijo gambar sunset indah rekomendasi,pos
kawasan candi candi prambanan puncak gambar candi prambanan sore view sunset pesona langit cerah gunung rapi halte transjogja andongdelman jalan rel,pos
dinner pasang teman indah pandang sunset lihat senja,pos
candi bagus kesni sore pandang bagus suka fotografi cocok view bagus,pos
cocok matahari tenggelam angel foto bagus uang manfaat tanda awat,pos
candi ratu boko luas candi prambanan candi borobudur candi ratu boko gak kalah bagus,pos
bagus bukit luas bagus dateng pagi sore siang lumayan panas,pos
letak lumayan kota candi prambanan masuk perhati mahal rupiah harga candi ratu boko worth,pos
rencana situs candi prambanan loker tiket tawar pake tike masuk candi ratu boko shuttle tiket masuk candi prambanan selisih harga tawar,pos
stasiun tugu candi boko motor harga tiket masuk mahal situasi bayar view lokasi candi bersih foto siang,pos
candi ratu boko prioritas utama wisata banding prambanancandi sewu borobudur unjung candi indah cantik candi,pos
ratu boko sore langit cerah matahari benam indah,pos
lokasi mudah asri alami tata rapi bersih nyaman kunjung fasilitas dukung lengkap cocok wisata keluarga samping sejarah bangsa informasi,pos
bagus sunset bagus fotografi sejuk santai warung jual makan mi instan,pos
nilai plus komplek candi luas butuh keliling jual kelapa muda komplek candi candi prambanan candi pintu masuk komplek candi restoran makan romantis outdoor,pos
candi prambanan sejuk indah cocok nikmat matahari benam,pos
salah sunset cuaca mendung letak pandang sunset spektakuler anak tangga lokasi situs makan,pos
cocok sunset panorama kota fenomena bukit selfienya kendara pusat kota tiket lumayan jangkau biaya parkir,pos
gak worth harga tiket masuk candi sunset sunset foto foto google udah edit cerah cerah mending lihat,pos
baguspemandangan indah klau bwa payung topi cuaca panas sekalisemakin sore bagus buru sunrise sunset,pos
candi cantik sore matahari tenggelam indah candi,pos
kompleks cani populer muncul film cinta luas panas bayar pandang indah,pos
beda candi libur pasang emnarik adventure short trip lindung tubuh musim panas payung pashmina,pos
sunset direview orangprang sunset diisni bagus magis kesana sore pikir bangun sjaa luas sekaliiii pandang bagus kesana mendung sunset bayang,pos
sore ramai unjung cuaca cerah degan lengkap photo hp buru sunset bangun candi tawan cantik suasana rameeee bangetttttt pacar rombong seru kesana,pos
candi liat sunsett cerah gituu tiket masuk okelahh view asyikk,pos
candi ratu boko komplek luas situs gapura mandi istana goa letak bukit view bagus foto anak lari halaman luas favorit jelang,pos
bagus cuaca cerah sip pandang fasilitas lengkap bersih,pos
destinasi utama candi prambanan shuttle bus candi prambanan berangkat candi utuh tinggal pelihara,pos
komplek candi ratu boko kompleks candi prambanan andal destinasi wisata candi ratu boko nikmat indah sunset untung matahari benam kotak batu candi ratu boko indah sunset,pos
nikmat sunset candi ratu boko tenang hati rumput hijau suasana sunset indah candi tatax rapi jaga,pos
pandang indah capai candi ratu boko bukit,pos
harga tiket sunset beda harga tiket pandang keren tata jaga lihat,pos
wisata cocok keluarga keren luas jual tawar minum masjid gak bingung sholat kesana jumat sholat jumat suami gak bingung,pos
tinggal agung bagus sunset nikmat makan malam lokasi nikmat sunset pandang candi prambanan jahuan pesona,pos
libur indah jelang matahri benam sunset sungguh indah candi datar best golden sunset,pos
sore sayang hujan turun deras candi tarik film lihat video tube cantik jalan kota gantung lintas kota mudah,pos
pandan sunset indah latar runtuh candi tiket harga,pos
salah temple kota jogya filem adc indah kota jogya temple ratu bokopokok asyik,pos
wisata paut scene cinta rangga menghabikan jujur tiada struktur candi teruja candicani runtuh suasa bersih,pos
candi rubuh hampar rumput hijau luas warna tumpuk batu candi suasana damai nyaman lokasi,pos
istana ratu boko wisata foto olahraga latar sejarah fotogenik kompleksny luas jelang sore siang,pos
kelola pt twc mengelolla candi borobudur candi prambanan candi ratu boko kelola bersih kawasan sampah coret lengkap fasilitas unjung toilet restoran sore,pos
candi ratu boko mrupakan raja masuk suguh suasana hampar rumput hijau pandang kalas candi prambanan tiket masuk bilang murah boko nuansa beda hunting foto sunset sunrise keren foto,pos
pusat kota gampang gps foto foto lumayan isi feeds instagram,pos
candi kisah sebar islam kisah ratu bilqis candi luas,pos
candi indah foto lokasi pandang indah lokasi kendara pribadi manfaat fasilitas tiket candi ramban,pos
candi ratu boko takjub hebat cipta istana luas indah patut acung jempol panas hitam far senang candi ratu boko,pos
view senja sayang untung jumpa mendung nikmat cahaya merah sungguh kagum agung mistis bersih pelihara fasilitas toilet,pos
jalan ratu boko gampang tempuh pusat kota tiket masuk jangkau masuk luas bagus cinta fotografi konsep batu candi nikmat senja,pos
biaya mahal candi ratu boko area luas,pos
wisata sejarah romantis candi ratu boko candi restoran candi letak bukit sore jelang magrib sunset good view lihat kota,pos
candi tawar bentuk bangun indah halaman luas dagang tawar es kelapa muda segar ragu coba es kelapa candi bentuk utuh utuh siang candi,pos
kesana kesana lokasi pnh shooting ulas dtg pagi sore klo siang panas ruang buka lokasi hrus jln agk tanjak dlu hrap,pos
candi ratu boko candi tinggal reruntuha luas jalan makan berselfi ria star parker tangga candi ratu boko tapak tngga,pos
asyik sore liat sunset anak bebas lari area candi area lapang umput,pos
candi april honeymoonlokasi kerenudara segar akses mudah tempuhhanya hrs tingkat armada bus angkut wisatawan prambanan krg blh tunggu,pos
candi prambanan candi prambanan istana ratu boko kejar kejar suttle bus cocok sunset eksotis letak bukit,pos
candi letak bukit pandang sunset bagus runtuh candi awat kondisi bagianbagian utuh anak tangga pintu masuk,pos
candi ratu boko candi prambanan tempuh motor mobil minibus bersepedamenjelang candi tanjak tantang goweser suasana pagi indah bagus sun set candi area candi,pos
candi ratu boko stamina bagus anak tangga kompleks candi lumayan luas hektar candi istana benteng lengkap kolam mandi pendopo luas ceruk goa tapa gapura paseban keputren,pos
salah wisata sejarah candi prambanan kalas beda lokasi candi ratu boko bukit tawar view tampil kota kawasan prambanan komplek candi luas,pos
candi prambanam kenal canda ratu boko lokasi mobil sore saksi matahari benam indah,pos
candi ratu boko rangka candi candi prambanan candi pawon tinggal raja hindu lokasi bukit unjung sambut suasana magis alam bantul halaman utama naung pohon beringin,pos
candi ratu boko kenal indah sunset soresorean cuaca cerah tawan,pos
pandang keren instagramable bangetselain ulik sejarah keraton ratu boko lihat pandang kesana siang pake payung sedia sewa payung harga gak pake payung gak panas,pos
ratu boko candi asing telinga candi candi romantis candi sore cuaca cerah lihat sunset manja nuansa romantis,pos
candi ratu boko candi kawasan komplek prambanan sore cuaca cerah sunset cantik,pos
kompleks candi indah kelola bersih rawat jaga kesan megah candi sore nikmat sunset,pos
garagara salah syuting pengin tinggal gapura pondasi puing istana tanah lapang luas damai sore sunset sore pintu gerbang masuk tutup,pos
candi ratu boko gerbang megah puingpuing pesona musim kemarau kenal sunset indah,pos
candi ratu boko candi prambanan recomended unik pandang alam foto bangett pandang kota pokok recomended istiemewa,pos
candi ratu boko kelola manajemen candi prambanan sedia shuttle candi prambanan candi ratu boko sedia candi ratu boko indah sunset hujan lebat esok pagi lokasi indah bukit pandang,pos
luas tinggal situs arkeologi beda situssitus kenal nikmat sunset lokasi bukit saksi pandang kota asri awat,pos
candi ratu boko indah nikmat senja senja jadwal jalan makan resto,pos
taman rapih pugar awat moga tingkat pagelaran,pos
nikmat sunset beda sunset lihat pantai penggalaman beda cahaya matahari sinar candi bentuk siluet indah tidka,pos
objek wisata puing sisa tinggal istana ratu boko viaw arah kota view sunset indah,pos
suasana mistis keraton bukit keliling pandang takjub lukis pesona matahari benam,pos
libur anak lumayan puas candi indah area luas anakanak puas larilarian bagusbagus biaya mahal,pos
candi lokasi rapi asri sore sunset pandang kota,pos
salah untung mudik kendara wisata jalur laluiratu boko tuju iniseneng nikmat pagi sejuk keraton ratu bokokesan masuk kawasan keraton bersih tata rapi sedia,pos
candi ratu book bukit pandang buka indah candi minimist lokasi luas obyek candi gapura goa restoran representatif pandang kaki bukit suasana nyaman,pos
ter indah candi ratu boko keraton ratu boko recomended keluarga bagus saksi sunset sunrise,pos
candi ratu boko kenal sunset bagus sayang kesana cuaca mendung nggak liat sunsettapi bagus foto situ kesana nikmat sunset,pos
ratu boko pandang indah ratu boko canfi abu arau kremasi raja raja lokasi krematorium lokasi ratu boko prambanan rapi borobudur cuaca cerah imajiner,pos
bangun indah unik nikmat senja sore tiket masuk dinner mungiin mw nembak gebetan dinner hehehehhe sumpah,pos
candi unik candi lainnyaarealnya luas gapura goa batu kuno kolam kolamlapangan istana bukitmeskipun daerah cuaca panas harga tiket paketlebih mahal,pos
menapaktilasi agung tinggal keraton jawa kuno bukit daerah prambanan rindu syahdu ituenak nikmat pagi senja candi prambanan taman tata rapi luas shg layak berlarilari kesana,pos
candi viral maya candi view takjub sunset bersih kelola senang keluarga candi jalan kaki tangga,pos
teman rindu kasih sunset mu rindu,pos
gak skrng awat indahdisini cocok foto ide lohkarena area candi luas sedia makan enak,pos
candi prambanan candi ratu boko beli tiket tur prambanan ratu boko loket candi prambanan sedia shuttle bus turis candi ratu boko letak lumayan prambanan,pos
area candi bersih toilet bersih siang topi payung pandang candi bagus angin milir,pos
suasana enak wwaktu sunset indah lokasi taman cocok santai hujan ribet teduh candi bentuk runtuh kolam,pos
lokasi batas provinsi provinsi jawa rekomendasi candi prambanan candi,pos
harga tiket temanteman awat bersih pandang kota sore sayang ngak sunset udah ngantri,pos
bagus dateng liat sunset cantik resto makan pandang karna candi bukit gt,pos
candi ratu boko lambang jaya nusantara indah eksotis luas hijau letak bukit pagi kabut pagi limut bumi arah gunung rapi candi,pos
candi ratu boko ckp sejarah pandang sgt indah candi kota saksi matahari benam,pos
hunting sunrise lokasi candi ratu boko inndah sayang sunrise siang akses mudah prambanan plaosan sambisari,pos
candi ratu boko indah kota lokasi datar indah,pos
candi prambanan kendara khusus anter puterputer candi boko bayar jalan candi prambanan nyampe candi boko pandang tilas rujak es,pos
indah pasang view bagus foto sore sunset romantis,pos
prambanan borobudur candi candi ratu boko situs arkeologi beda situssitus cocok sunrise,pos
candi boko letak candi prambanan eksotik area candi luas titikspot sejarah candi boko pandang indah suka,pos
candi ratu boko bukti raja jawa lestari destinasi ratu boko bangun candi sunset candi parkir resto,pos
sore gerimis bayar lihat pandang keren sore lihat sunset romantis cocok foto lokasi candi fasilitas lengkap,pos
benarbenar bagus nikmat sunset musim panas langit cerah jelang matahari benam matahari masuk pajang tengahtengah gerbang candi ratu boko view malam indah,pos
bersih toilet bersih pandang bagus foto foto heheheee bagus dtg pagi sore jelang matahari terbenan,pos
nikmat sunset candi candi nikmat masuk candi biaya wisatawan domestik harga lihat worth,pos
ratu boko anggun anara kenal indah sunset gerbang candi letak cantik suasana,pos
letak mudah capai cocok hobi fotografi sunset,pos
candi ratu boko rupamnya keraton letak bukit pandang indah nuansa mistis kental bagus sunset foto unik jugawajib,pos
lihat sunset indah candi rat boko beli tiket candi prambanan candi ratu boko dngan sattle bus,pos
candi megah komplek indah nikmat sore pandang indah matahari benam sempurna cocok rekomendasi laksana nikah luas sungguh indah,pos
unik cantik candi ratu boko pukau suasana langkah kaki pintu masuk desember keluarga siasia candi lahan luas,pos
habis prambanan beli tiket candi ratu boko sungguh ajaib candi,pos
beda sore udara panas pemandngan suguh sejuk hati nikmat sunset candi ratu boko sangt indah romantis kerja pekan,pos
rekomendasi wajib packet tawar candi prambanan candi ratu boko fasilitas sedia prambanan shuttle bus,pos
situs kompleks luas letak puncak bukit pandang keliling indah area luas pugar desa situs sejarah bangun gapura,pos
candi ratu boko candi prambana hrs lestari jaga indah,pos
wisata ratu boko tempuh amil candi prambanan ratu boko sedia bus mini berangkat mnit pandang kota tawan candi ratu boko payung cuaca panas,pos
tau canti staff prambanan tawar trip candi ratu boko prambanan candi letak kompleks prambanan jarak lumayan untung prambanan sedia kendara candi wisatawan,pos
canti surga gemar selvie candi lereng gunung manja pandang indah,pos
ratu boko timbul komplek istana luas puncak bukit runtuh bangun kolam istana unik sayang informasi cagar budaya informasi lokasi ratu boko,pos
indah dateng sore sunset indah udara sejuk bebas polusi,pos
candi bentuk gerbang lenyap tata kelola candi bagus keren keren candi,pos
candi ratu boko salah lokasi sore pandang matahari tenggelam lihat puncak candi tawan lokasi luas rekreasi keluarga,pos
candi candi panggil pulang candi simple megah tapipeaceful hommy cantik sunset kalah kerabat,pos
gagal ratu boko sunset ratu boko pagi suasanan pagi tenang indah loket pagi,pos
area wisata unik gerbang komplek candi sungguh pandang area candi boko awesome,pos
suasanany tenang romantis cocok pasang nikmat pandang kota bukit uuuhm keren lelah olahraga timpal capek sore,pos
akses ratu boko bis trans halte prambanan sambung ojek area wisata sangan cocok hunting sunset pulang daerah kota akses transportasi candi alhasil,pos
cocok buru foto pandang cadicandi khas jawa hibur murah,pos
leluhur bagus bangun sungguh biasaim proud indonesian,pos
nikmat sunset candi ratu boko sunset indah candi butuh jalan lumayan lelah kaki,pos
prambanan beli tiket pandang bagus karna bukit sayang cuaca panas,pos
area candi ratu boko luas runtuh jeli bagus foto sunrise sunset indah,pos
hebat romanticitulah keraton ratu bokocermin hebat nenek moyang peradabanromantic sekaliutamanya sunsetwow indah sekalikalo fotoakan keren,pos
nyeselkunjung candi datar candi prambanan history candi prambanan keaan tersendiripemandangan indah,pos
cocok nikmat senja matahari tenggelam suasana nyaman romantis indah indah,pos
candi ratu boko jarak kota shuttle bus candi prambanan view tawar andi ratu boko rumput hijau bentang luas langit cerah datar,pos
jangkau mudah sutle bus candi prambanan sore sunset tawan,pos
candi awat akses jalan candi pandang sunset indah malam lampu landas bandara cantik,pos
candi awat dagang asong ganggu buru matahari benam area candi restoran moga kondisi,pos
lokasi candi prambanan bukit sepeda motor mobil laku lokasi indah nikmat sunrise background candi payung topi nyaman,pos
bagus sore sunset romantis beli tiket candi prambanan harga murah beli,pos
candi ratu boko candi siram cahaya sunset indah pancar sinar matahari benam indah candi sunset,pos
borobudur prambanan candi runtuh ratu boko layak masuk kecewa tata indah bersih nikmat sunset tangga runtuh candi senang bagus tata wilayah,pos
beli tiket masuk prambanan ratu boko masuk area mobil shuttle prambanan ratu boko lokasi luas tangga pagi,pos
rombong kerja pintu masuk loket suasana teduh karna pohon beringin masuk areal candi cukum lumayan bangun candi gapura candi,pos
candi indah pandang sunrise sunset candi favorit taking foto tiket masuk candi rupiah letak jl piyunganprambanan transportasi candi prambanan angkot,pos
letak arah selatan pasar prambanan piyungan akses kendara kenal candi prambanan borobudur istana ratu boko simpan unik megah istana abad,pos
candi letak bukit kompleks gapura candi kolam mandi alunalun area area luas buru mengexplore gapura candi relief candi megah,pos
ratu boko banding borobudur prambanan enak suka tenang eksotis menurutkuu tiket murah saran mending sunset beautiful view international domestic tiket masuk,pos
suasana sore sunset bagus halaman luas alam indah,pos
pandang indah sore jelang matahari benam lokasi kota moda transportasi lokasi,pos
candi ratu boko cantik senja haridari lokasi parkir jalan enaksudah area kompleksjika capek duduk duduk berphoto ria area candi terawatbersihsaya suka dsinienak sore sore jelang senja,pos
aktivitas putri area candi bersih awat restoran pandang candi prambanan kereta api lintas nun,pos
view prambanan indah wisata santap hidang restoran,pos
bagus luas bukit pandang sore sungguh kagum,pos
ideal candi ratu boko sore langit teduh hias cahaya oranye senja kompleks candi muncul siluet magis bukit main kamera spektakuler,pos
candi sepi jual bersih areal luas pandang kota suasana damai sejuk,pos
indah recommended bagus foto tampil theater candi ratu boko beli tiket candi prambanan,pos
bosen candi prambanan emang candi prambanan sunset bagus liat candi prambanan karna candi letak bukit cocok,pos
nikmat suasana segar candi ratu boko pagi udara segar embun siang terik komplek luas candi hancur parkir sedia resto,pos
candi kraton ratu boko utuh letak bukit candi prambanan candi ratu boko nuansa indah alam besarbesar,pos
candi datar tanda agung makmur megah nyata jarak panas terik matahari banding surut keraton boko keraton hindu,pos
sejarah preweed aj cocok suasana ratu boko sore gillaaaa tiada istana ratu boko siang panas ampunn mending sore pagi,pos
candi ratu boko sulit jalan kelola candi rapi toilet bersih teman jatuh cinta pohon letak pintu candi,pos
